,predlabel,trueLabel,indexLocat,review,classification
45,1,0,710,not brilliant rooms thread bare carpets on main stairs smells of damp in the stairwellwardrobes knocked up by inept carpenters bathroom had mildew on bath surrounds and the sink was sunk into what seemed to be an excuse of some old piece of kitchen work surface radiators were grubby rusty plaster falling out of wall supports good attempt to hide that behind the curtains folks advice for prospective guests avoid room advice for owners sort it out and put a bit of your profits back into your business all this for for two nights room only welcome to the rip off parliament hotel,VADER
46,1,0,715,i paid approx for a room for one night breakfast not included as my partner and i were down to dublin to watch coldplay i will admit it was close to croke park upon arrival the guy on reception assumed my partner and i would want single beds being guys when i corrected him and said the double was fine he smirked and went ahead with checking us in the hotel must of been grand and luxurious at one stage but it is dated and old now a bit of reinvestment by the owners would do wonders for the business the bedroom had old creaky furniture which was too big in a small room the bathroom was tiny but did have a nice selection of soaps and products a wet room would be much better here the room was spotless and there was a kettle and coffee but no tea also in the room is an iron plus board and a hairdryer there was no air conditioning unit and the room was roasting would have been ok with windows there but we could open them more than a crack although we were there on a saturday the area did have much happening and seems to be pretty quiet the hotel has a pool and leisure facility which we did have time to but you do need a code from reception to get into it a carvery was offered in the and upon inspection we decided it would be better to,VADER
47,1,0,732,the clean towels are stored on top of blue plastic on the floor of the hallway these clean towels are exposed to people shoes dust and other pollutants the shower doors are closed allowing water to spill on the bathroom floor room was dark and dank a substandard hotel at best depending who is on duty results in pleasant or unpleasant communication to generate the requested results my request for shampoo led to the maid busting into my room after knocking only once i was naked to prove to me that she had put shampoo in the good point is that it is in close proximity to the city,VADER
48,1,0,735,the room i got had a beautiful view of the acropolis but the air conditioner did not work and it was a very hot night luckily i only needed one night because i was leaving to the islands the next day the hotel is outdated and the towels looked old and overused like everything else you get what you pay for the location of this place is a plus thought it close to plaka and monastiraki the area is safe and it has a lot of restaurants at walking distance,VADER
49,0,1,743,the hotel met our needs it located close to the dam square the red light district and the central breakfast was very reception staff was took a room in the fifth floor it was basic room and very small but it did bother us because we spent all our time outside but if you plan to stay more time in the hotel room you should ask for bigger room,VADER
50,1,0,751,not normally something i do as i believe that people have off days but i just had to comment on my recent stay at w hotels as i found the following to be causes of checked into the hotel from another hotel in the city as we changed our flights and wanted something a bit more in keeping with what we re used to and decided to book at the hotel at and went directly to the floor for check in we were advised that the room would be ready shortly and that they could take our bags and would be returned to us upon to the room and that they would contact us directly by text to advise the room s availability it came to and we had still not been contacts so we went through to reception where they d my payment card even though i had already provided full for recommendations of lunch and was given a suggestion of the focaccia dip and the spicy tomatoes the tomatoes were lovely but the focaccia was burnt and then asked about the spa facilities in the hotel and were advised that they were indeed closed for the day due to unforeseen being a guest at hotel de lerope in amsterdam i decided to visit w as it was a more modern hotel and thought that it would have a younger and more feel to it but this did not live up to the calling reception times over the period,VADER
51,1,0,759,for being a hilton hotel you expect high and good service when the prices are that high forgot our orderlazy in the barservice remote did worktook the freedom of giving us the most expensive alcohol in the drinks without askinggave us the wrong billthe staff were friendly but should maybe have a lesion in hotel service not worth the visit,VADER
52,1,0,784,if you want to hear music loudly until early hours of every morning temple bar inn hotel is the place for you i am not that kind of music fan so i was really disappointed about the noise that came to the room from bars in this building and around the fleet street i have to say that the location of this hotel is great near shopping areas and hotel staff is doing good work but those are all the positive sides of staying room where we stayed nights was really basic and small it even lacked elements like soap tray in the shower and hangers for jackets that we had to ask separetly there were no ventillation so you had to open windows for fresh air to come in and after opening the rhythm of bass drums was even louder until or of this can be experienced in budget style hotels but not in hotels that cost over euros per night my advice is to go somewhere else if you are not wealthy bass drum rhythm lover,VADER
53,1,0,789,when i got to the hotel i was amazed by the beautiful modern and clean smell of the lobby that image was destroyed when i got into the room the carpet was filthy full of stains and the humidity smell was awful the ac did work which made the humidity worst i was changed twice to different rooms but the problems were the same at midnight one of the front desk guys came and advised me they did have any ac i finally quit and tried to enjoy the stay peter from the front desk was very helpful and nice to even gave us good recommendations to enjoy the city which we loved despite the hotel rooms breakfast is varied and good restaurant food is delicious expensive though,VADER
54,1,0,791,not impressed rude reception staff extremely rude manager myself two friends stayed in blooms as we attended a concert in dublin when we arrived back at hotel after our night out it took the doorman about minutes to answer the door there was anyone on the reception desk or answering the we were three women in a part of town who did appreciate being locked out at that hour of the night approximately it is safe anywhere the breakfast was horrible and i had to ask times for some ice for the oj as it was just sitting out all morning this hotel is a pure tourist trap and they should be ashamed to be changing people to stay there never again i wrote a review on their facebook page and they did i noticed that they only replied to which there were many of,VADER
55,1,0,796,i had booked this hotel a few months before the visit once i arrived they told me there were no rooms for me as they accidentally overbooked now this is annoying but i know all hotels do it so i ca fault them for this they did give us free drinks and taxi us to another hotel relatively close by they had told me to get a receipt from the other hotel for breakfast so that they can refund me too this was all sounding great even gave me a card with a number to call in the morning so they could arrange a taxi to take our bags back over and put them in the room for morning comes around i get my receipt call the number on the card and i met with this number has not yet been assigned to an agent the staff at the illunion hotel were fantastic and helped get in touch with the sansi hotel only to find out that they had no record of me needing a room or for them to pick up my stuff after a bit of back and forth and the sansi staff calling a manager they realised they were supposed to give me a room and pick us up we dropped our bags off and headed out for the day the sansi hotel is in a great location minute walk to the docks upon returning to the hotel we checked in and i asked about the refund,VADER
56,1,0,800,stayed at this hotel with my family booked rooms found human faeces on the bathroom floor in one of the rooms still waiting on gm of hotel to call me back duty manager changed the room which for me should have been automatic and a free dinner which is very ordinary given price i paid for rooms i sure they will reply now did even refund the one room one would assume they would way too late not what you expect for a star hotel considering so many other star hotels do not book here how unhygienic and how badly to handle my complaint human faeces very disgusting i rarely post reviews however always read them i hope this helps others please check out other star hotels in athens i would hate for another family to have their last day on their holiday be spoiled like us,VADER
57,1,0,809,we stayed here during part of two week trip through ireland london and scotland first of all the location was terrible even though the tram is right outside the hotel you are as far away from the attractions as you can get also the entire area is under construction and felt very unsafe the room was also a let down it was small outdated and the curtains were not even attached to the rod so we were not able to close them we were put in a room with two twin beds and our daughter had to sleep on a bed all were extremely uncomfortable not that we were sleeping anyway but it was extremely loud on our second night the hotel hosted some sort of party that kept us and several other guests up until after when we called to complain we were told they would shut the doors but that never basically stayed out exploring as long as possible to not have to return to our room although we did not like our hotel we did love the people of dublin,VADER
58,1,0,827,my wife and i were booked for five days at this hotel because it was the conference venue for an event at which i was speaking we were also sponsors of this event well our visit was a farce from start to finish largely due to this incredibly inept we booked months in advance and were relegated to a tiny room on the outside of the sixth floor as we were on the outside perimeter of the building the walls were slanted just under the roof as such it was very difficult for two people to move around in this small room and we had to do this for five nights even worse the bed was simply too small for two people i measured it to under cm my wife and i were constantly pushing each other over the side during the night we asked to be moved but the hotel apparently had no other rooms curiously a colleague booked a room at a remarkably better rate about a month before the conference and had a spacious room on the third floor with a big bed and two chairs she arrived a day later than we did i had to send some documents to the united states and needed a fedex envelope the reception said there was no business center but i should talk to the concierge the concierge referred me to the business center one flight down the business center said the fedex envelopes could be obtained from the,VADER
59,0,1,838,the location of this hostel is really convenient right next to a major train station there is also a large common area for lounging the rooms can be a bit difficult to handle with so many people assigned to one bathroom but it manageable,VADER
60,1,0,870,arrived at the hotel at only to be told that our room was not booked even though we had received a confirmation email and phone call our room was clearly given to someone else do not stay here i would also like to mention that the photos are deceiving,VADER
61,1,0,886,the whole experience was disappointing we were made to wait for minutes before our room was ready and this is after the check in time of there was a line of people waiting and we had to queue three times before our room was finally ready we entered a warm stuffy room where the air conditioning has not been switched on it is definitely not what i had expected based on the review i will definitely not be coming back be ready to be disappointed,VADER
62,1,0,889,the room was clean steday wifi freat th floor and secent breakfast pretty far from the city center but all pales compare to the bed we ordered a double bed and got teo twin beds pushed togeter with a flat twin mattress on each which didnt even fit the bed i dont know how a hotel which respects itself can call this a decent bed i understood that all beds were like this very disappointing,VADER
63,1,0,896,we stayed nights on arrival no offer of any help with the bags and it only got worse staff decidedly unhappy in most areas breakfast was busy but again staff inattentive the hotel itself was tired and clearly ready for redevelopment which was happening on almost every side of the hotel avoid if possible as there are much better hotels nearby,VADER
64,1,0,899,very nice view from the heat in the elvators the need to wait around minutes to the working at the reception think that they are doing you a favor by staying at their hotel they forget that the guests are paying their salaries,VADER
65,0,1,922,it should be minutes walk from amstel station which is a transport hub with trams buses metro lines and overground dutch trains all stopping there tram takes you to the main museums and musical concert place in about minutes you could go from the airport one stop to zuid and then metro stops up to amstel a bit quicker than going via central station the hotel is modern and clean,VADER
66,1,0,926,the hotel charged me for credit card costs i did not approved or made i did not paid with a credit card in addition the reimbursement of the breakfast expenses i did not consume did not happen to me this does not constitutes affordable luxury,VADER
67,0,1,934,all we can say is very good service very good location excellent service from the staff we will come back again sometime but the bar closes way to early that is the only negative thing i have to say,VADER
68,1,0,958,maple hotel was an uninspiring experience ok the location is good but that is the only positive response i can give we had a double the size of a cubicle one had to sit in the bed while the other we were on the first floor facing the heavily trafficked street thank god we had earplugs,VADER
69,0,1,988,the best of many good things about this hotel was the terrace on the top floor plenty of chairs and tables from which to survey the spectacular view the acropolis to the north and the city and the mountains beyond it to the east and south we took our breakfast up there on a tray no problem going from ground floor to fifth with a lift every morning and our coffee or wine every evening it was a spectacular way to start and end each was also well placed not only was the next road on the sightseeing tour bus routes but the junction with that road was opposite a shady little path that led to the main footpath to the acropolis so instead of joining the gathering throng in the scorching crowded and noisy coach park a walk up the road to our left we padded our way between ancient trees and shrubs on a path worn by feet ancient and modern over thousands of years and joined them a little further up only a little but it was more magical the hotel staff were extremely helpful and pleasant at all times whether we needed to know about museums restaurants bus routes etc they telephoned hertz for us when our lack of greek and the hertz office busy times made it difficult for us to sort out a problem with times for picking up our hire car and then one of the staff parked it for us when fitting,VADER
70,1,0,1000,room through a maze of corridors no offer of help with luggage reception rather disinterested room has very thin walls currently listening to guy next door talkingno windows open as very stuffy from am has been noise of trollies skips being loaded and moved incredibly noisy sounds like bin lorries or similar for hoursroom must be over kitchens as smells of breakfast cooking from ok but not the cleanest literally an inch of fluff and dust on side lights above the bed are filthy furniture tatty and marked general all a bit run down and scruffy dated and dingy,VADER
71,0,1,1013,the davenport hotel is located near the center of dublin ireland just a block north of merrion square it is also located about a block east of trinity college and several blocks south of the river liffey it is also located next to the house were oscar wilde grew up it is now some type of small college the hotel is located about miles from dublin international airport or approximately minutes by taxi longer if you are in rush hour stayed here for nights in late may with my wife and youngest daughter and thought the hotel was nice and also thought it was in a great location near many major tourist attractions we paid a night for a triple room one king size bed and a twin bed which i thought was pretty reasonable breakfast was not included and was euros per day per person i thought the lobby and bar area were nice looking and i also liked my hotel room the carpet and furniture were updated in addition the room was above average in size the front desk people were friendly but there only seemed to be one on duty at any given only complaint was the poor breakfast service the main breakfast room was full so we had to go to the bar area where the guy working there was lazy and would not help us i thought he was a dishwasher or cleaning person we had to walk back into the other area and ask,VADER
72,0,1,1037,highly recommendable for location nice hotel people at the desk are helpful room has everything you need the pub next door is a bit loud but one is so tired in the evening that it does really matter because you fall asleep right away,VADER
73,1,0,1049,the team have a serious communication the service at the restaurant it terrible night a random person enter our room at it was another guest that mistook the door the explanation of the hotel was that an error in the system allowed for a few minutes any card access to any door other day when i closed the room door a piece of roof ventilation whole felt down thanks good i closed door from inside otherwise it would break my head when you have any issue that you want to report to the manager it really dificultades to reach him not serious for a star hotel,VADER
74,1,0,1051,michelin starred restaurant closed for vacation not mentioned when booking concierge did not follow up when promised on a reservation we had to follow up on status they were unable to obtain a reservation day lost along with any chance to obtain a restaurant booking a street restaurant for us turn down service hit and miss omg the basics had to ask for that also in fact had to ask twice each time for the simplest of requests this hotel is living on a reputation and most certainly do not understand that a star reputation has to be earned every day that is why we pay so much who knows it may be your turn next to have our experience,VADER
75,1,0,1057,had high hopes for this hotel but it was at best described as adequate loud vicinity appreciate that the hotel can only do so much to address this but more could be done in terms of the decor worn out carpets on the stairwells and very low budget shower curtains that stick to you you know the ones polite enough staff but they have an air that they are just going through the motions did find them very genuine it a shame as this place could be so much more,VADER
76,1,0,1074,we visit amsterdam at least once a year we had visited the restaurant in the hotel on a previous trip so selected the hotel as we felt we knew what to arrival our room was ready nor was it ready over an hour later when we been told it would had paid for a deluxe room this is not the basic level at the hotel on check in i was told that the room did have a city view even though it was on the first floor on entering the room it became very clear that not only did the room not have a city view but it did have a very unattractive view of the bins and yards of the opposite apartments i will attach a photo the room lights did not respond to the remote controls and the room was very i raised this with reception i was told that if i wanted a city view i should have asked for one even though it is part of the room description described on the hotel website we were moved on our second night to a room of the standard we had booked however that hardly a good start to a vacation the room we moved to was great had lots of light and a view we expected but no apology or recognition of the issue with our initial in all we felt that we were not valued customers and that quality of service and ensuring that we had,VADER
77,0,1,1083,the hotel was reasonable the rooms on higher floors have a nice view on the sea the rooms were shabby but properly cleaned the breakfast was not wow a small hotel located at walking distance from glyfada center,VADER
78,0,1,1094,overall the hotel is tremendous i did not give a for a couple of reasons the front desk staff is not very friendly and in particular francesc was condescending both on the day we checked in and the day we checked out overall that did not affect our experience much but it is something they could work on none the less also the housekeeping staff was very pleasant but only of days did we have turndown service which again not a big deal but is part of the price also two of the days we returned from our long day outside the room and at it had not been made up this was annoying because the cleaning cart was camped outside our room all day everyday yet our room is last i tip the cleaning service everyday so it could not be that it probably explains our difficulty on the first day we got there at and asked if early checkin was possible the woman at the desk said the cleaning people are outside your room now so it should be an hour or less well we came back in an hour and a half still not done this was the time she reminded us in a teachy condescending way that time is uh we know you told us we could check in earlier so we left and came back at around still not done this is when francesc mansplained that the check in time was so we knew that,VADER
79,1,0,1120,the staff was very friendly and the breakfast choices were great that where it ends the rooms were run down with stains on the carpets cracked tiles in the bathroom old and stained sink and beds absolutely disgusting the price per night was crazy at per night we shortened our stay from to night and checked into a local marriott hotel instead at half the cost,VADER
80,1,0,1131,noise from other room is so big that i could sleep well every some water that where it came from are all around my shoes so my new shoes from barcelona became wet two things above was bad but other things about the hotel was good,VADER
81,1,0,1132,we had the displeasure of staying at his hot er place you could call it while on a transfer from athens to beirut we had to walk up several flights of stairs and wake the reception guy up so he could check us in he checked us in topless which was in our early expectations of the place the room was cheap and big however the next day we discovered several cockroaches were on the ground beside us when we woke up we had a fan to help air the room but to be honest we were happy to leave the room at any chance we got we were planning to stay there again on our return transfer back to dublin but we cancelled and booked another place which was a lot better avoid if you can unless you are happy sharing with uninvited cockroaches otherwise you love it,VADER
82,0,1,1154,wanted a change from the usual hilton type hotel and chose the morgan because of ta reviews and location this is a small boutique style hotel with luxe fittings and furnishings however all is not what it seems if you look closely the place is starting to look tired the phone in my room was of the euro variety and the carpet in my bedroom is beginning to look grubby amongst a whole host of small things this place needs a little time and attention spent on it by the owners complete with a new lick of paint otherwise they will kill off what is essentially a lovely funky place to stay oh and one final thing the buffet breakfast needs to improve frequently running out of sausages and bacon an omelette stations would also not go amiss,VADER
83,1,0,1158,stayed for one night the hotel looks good from the outside and reception area but as soon as you go in halls leading to rooms its like you stepped back in time to the rooms very dated we booked an executive room only difference it seems was the bed was bigger building site to the rear of the hotel so its very noisy from,VADER
84,1,0,1161,super expensive hotel and inflexiblenon smoking room smelling smokehalf a soap in the roomparking too far awayno breakfast before am without breakfast basketi do recommend this hotel it is abusing of its location,VADER
85,1,0,1162,the hotel is an aging and quaint location it clearly needs some maintenance and they decided to do it right outside our rooms while we stayed there for over for days i like to sleep in peace and not be poisoned workmen woke us up on day one that day they painted in a gloss paint that had a fairly heavy odor my wife was affected by it breakfast was average and the staff attempted to be pleasant i suppose but for the money you can probably do better it was the only place in ireland we stayed in that was disappointing,VADER
