,predlabel,trueLabel,indexLocat,review,classification
0,1,0,54,room was excellent cleaners were meticulous and reception staff spoke excellent english and had great local knowledge restaurant food was ok but rather bland however excellent and cheap local tapas bars just around the corner i am a nice bloke and normally give i am easily pleased so why halfway through our holiday we were attacked in our hotel room by a huge muscly naked man who was off his face on drugs we went and got security who manged to get him out of our room and back to his room when we went back in the room there was blood and water all over the floor we had to throw away our towels toothbrushes cosmetics and shower stuff as they were covered in his blood reception moved us to a different room for obvious reasons we had a great room overlooking the pool and with a view of the famous familia cathedral our new room was next to the main road looking at the hotel bins nice reception staff were nice and said sorry and that the following day management would speech to us and offer compensation nothing was ever said did they call the police we were just left in the dark i got the feeling this had happened before and the hotel wanted to hush it up was the naked man a manager we spent the rest of the holiday wondering if we would be sat next to him at breakfast not a nice feeling,VADER
1,0,1,72,well what can i say the reviews of this hotel dont lie its great from start to finish ahhh be warned the taxi from el prat airport to the ohla is about eur however the taxi drivers add on a eur to eur tip or charge on top be warned factor in ok back to the hotel we stayed in a junior suite however it was effortless the reception staff are excellent on the ball when entering the room is clean spacious and the bed was ernomous however be warned there is a huge bit of glass separating the room from the bathroom so if you not comfortable in being erhum in the nude in front of your loved one then this hotel might not be the one for you in the bathroom you have a walking in wet room shower and a bath the toilet its behind or adjacent to the front door took me minutes to find it i thought we been burgled and some strange weirdo had nicked the karzee it had everything be warned the air con is fresh it works really well flat screen tv is temperamental but the late night bed fold down service is great too my girlfriend loved the chocolates they popped on the pillow as we returned from our night out overall you be hard pushed to find a better hotel the pool area on the floor get there early to avoid disappointment there are only bean bag sun loungers which,VADER
2,0,1,78,very nice hotel with rooftop pool wish there were more seats by the pool can be use the restaurant so ca tell you how it was but the seating outside was not available for food service only drinks we woke up in the middle of the night because the staff was clearing dishes not a good time to do that but mostly very good and convenient to sights bus taxi etc,VADER
3,1,0,82,we stayed at this hotel before our cruise guests with rooms for two nights a significant investment we went hotel directly from our international flight we knew check in was til later afternoon but hoped for a place to freshen up a bit it was like for us we returned to the hotel at and for our family with rooms we only had ready at we were late for our pm reservations to sagrada familia and no one seemed to care others were waiting for rooms also by sleeping in the lobby i not sure how difficult it would be to have enough staff to get rooms turned around more quickly especially for that first night after international travel the hotel is beautiful loved it and the rooftop area i wish i had felt more cared for in the check in process,VADER
4,1,0,87,the team have a serious communication the service at the restaurant it terrible night a random person enter our room at it was another guest that mistook the door the explanation of the hotel was that an error in the system allowed for a few minutes any card access to any door other day when i closed the room door a piece of roof ventilation whole felt down thanks good i closed door from inside otherwise it would break my head when you have any issue that you want to report to the manager it really dificultades to reach him not serious for a star hotel,VADER
5,1,0,88,location is good rooms are clean although on the small size however the beds are not too comfortable and the noise from the pub downstairs is unbearable in other countries this place would just not get a licence as a hotel we would recommend travellers to keep off this noisy place,VADER
6,1,0,105,i had a transportation issue that stranded me in togo africa for two days causing me to not be present to stay in the room i booked i was in africa as part of my studies assisting members of the peace corps i booked through and i did not choose the option to get a refund i acknowledge this fact i contacted the hotel to let them know the situation thinking that they might be customer service oriented and have compassion for a student budget i completely understand them charging me for two nights of three because i was going to arrive there on the third day but they gave zero leniency and basically told me that if i had booked through the hotel website that they would helped me and that i should contact which i did response was that they could refund me but the hotel could if they saw fit to do so when i finally arrived they had deleted my reservation entirely likely so that they could book out the room in my absence i had to wait almost an hour to have my reservation reinstated in the computer system the young lady that completed the reinstatement of my reservation was the only staff member that was in anyway helpful or kind i have worked in the hospitality industry including resort hotels and this experience in my opinion deserves a zero rating this pretentious frat house that calls itself a hotel is the worst i suggest,VADER
7,1,0,131,if you request a standard deluxe room newly updated you will love the balcony hotel pere iv has no bellman to assist with luggage and taxi it is very hard catching a taxi at this location especially with no staff assistance yes of course free wifi but the connection is extremely front desk staff is nice but they are not trained correctly especially planning reservations for brunch dinner etc with the wifi hardly working the front desk staff wifi works just as slow beware,VADER
8,1,0,143,first impressions are good really nice lobby friendly reception staff but no doorman as a hilton gold member i was upgraded to a room on the higher floors the room was a reasonable size immaculate and tastefully decorated with a feel the property next door is undergoing building works but did hear any noise during my stay the bar is also nicely decorated and has a good selection of service was variable initially attentive but had to approach the bar to reorder on both occasions even though it was busy and staff lacked knowledge on the menu having requested a swedish whisky which i was pleasantly surprised to see on the menu the staff member had to go and check with another on them not being able to locate it she then pulled an arran a scottish island whisky off the back bar and suggested it hardly the same the hotel has a couple of restaurants alfie and coberg the first has pub food including a number of veggie options the second which is also where breakfast is served has very limited veggie options pasta and salad with the vast majority of menu being meat and fish i did dine in either given so many options nearby in town breakfast was a disappointment no orientation was provided with regards to what was a la carte such as toast vs self service on being seated and it not being particularly busy it took minutes from ordering to get a cup of,VADER
9,1,0,145,the only reason to stay at this hotel is its proximity to the conference center next door the hallway outside our hallway smelled of a dead rat housekeeping never came unless called and requested the swimming pool is a joke for a family it is more like a hip hangout with people smoking shisha and behaving poorly we were concerned an escort service was being run out of the pool area just avoid this hotel there are so many other hotels which are much nicer,VADER
10,1,0,186,when the best thing you can say about the hotel is that you liked the front desk staff know it not great truly the guys at the front desk were very helpful and professional we booked an eight day greek vacation after backpacking and self guiding ourselves through italy for weeks through an aegean travel agency we had two nights in athens before heading to sifnos and serifos islands and then one night in athens again before ending our trip we were picked up at the airport and transferred to hotel economy by a great taxi driver i guess we should have known by the hotel name what kind of place it would be first of all it basically in the red light district as i would call it there are therese two minutes in any direction the hotel is very dated the beds are hard and the pillows are harder the bathroom is barely big enough to change your mind they could use plastic shower curtains you flood the bathroom when you shower thank goodness for drains in the floor you have to sit on the toilet to shave your legs actually sort of handy the refrigerator does work when you leave the room it connected to the key so there no chance to have cold water when you return from your shopping or tour it very noisy outside as well as above you the continental breakfast starts ta that late if you from the us it a pretty,VADER
11,1,0,217,the hotel itself is quite nice and clean however when i arrived at my room was not ready and the staff took over an hour to get a room for me the staff clearly need training in customer service it is very expensive and in no way justifies the price i will not stay there again,VADER
12,1,0,223,the hotel is very old like a bit of a haunted house the staff is very friendly helpful the rooms are very nice but big problem we saw a baby rat in our room the vibe of the hotel is amazing old type hotel i wouldnt stay there again,VADER
13,1,0,241,first impression of the room was cool but the you start finding how dis functional the room really is there is no privacy from the bathroom to the rest of the room glass see through door and wall it was good for watching tv from the a very small mirror in cupboard to check your bathroom sink is in the bathroom it in main room but no mirror and no power point for hair straightener or electric shaver etc the power point is at the desk bellow the tv with a very small makeup poor lighting in the room which made doing makeup back and neck from bed and things were the staff were very friend helpful nespresso coffee in the room was a very nice to tram was great but next trip i will stay closer to city it was a little bit far out if you need to drop shopping off or get changed before going out for the area of vondelpark is beautiful in every way but more suitable for relaxing people rather than party people,VADER
14,1,0,263,this was the biggest mistake i have made on my trip to ireland please learn from my mistake this place must make money on the bar only it did not look like they put any money into the hotel itself the sour smell in the room was horrible the twin beds leaned to one side had to use a pillow to stop from rolling off the bed cramped small the bathroom was so small you had to turn sideways to get into the shower that did not have hot water the music and young kids started lining up at for a night of fun do worry but they were leaving but then again the staff would start putting the empty kegs on the street at sooo enjoy the hours of sleep food was not hot or tasty the dining room was a makeshift coat check at night made sure it still had a wonderful aroma in the morning for breakfast please note pay the extra few dollars and find a better only plus side walking distance to down town,VADER
15,1,0,268,i paid approx for a room for one night breakfast not included as my partner and i were down to dublin to watch coldplay i will admit it was close to croke park upon arrival the guy on reception assumed my partner and i would want single beds being guys when i corrected him and said the double was fine he smirked and went ahead with checking us in the hotel must of been grand and luxurious at one stage but it is dated and old now a bit of reinvestment by the owners would do wonders for the business the bedroom had old creaky furniture which was too big in a small room the bathroom was tiny but did have a nice selection of soaps and products a wet room would be much better here the room was spotless and there was a kettle and coffee but no tea also in the room is an iron plus board and a hairdryer there was no air conditioning unit and the room was roasting would have been ok with windows there but we could open them more than a crack although we were there on a saturday the area did have much happening and seems to be pretty quiet the hotel has a pool and leisure facility which we did have time to but you do need a code from reception to get into it a carvery was offered in the and upon inspection we decided it would be better to,VADER
16,1,0,274,dont stay in this hotel if you need an extra bed in your room my son could not sleep in his and we had to stay tried night but got sore back after having the metal springs in the matress hurt his spine and do not expect to get any help to get better bed either you will only hear lots of even i booked the extra bed week upfront they prefered to give the good extrabed to someone arriving same day who had not booked this in desk manager told me they were a big group arriving bit earlier than really dissapointing,VADER
17,0,1,317,the student hotel at amsterdam city was overall just what we needed at the end of our week backpacking trip we stayed nights there after traveling with backpacking backpacks hoping between hostels shared with people so we really appreciated the privacy cleanliness and an actual quiet and comfy bed however i do have two criticisms that i believe can be easily fixed firstly our room was never cleaned even though we put up the please clean our room sign not a big deal but just letting you know secondly when we rented bikes from the hotel and rode back after a really long day in the city we accidentally biked all the way to the student hotel amsterdam west when we tried to return the bikes we were sure why our bikes did match the bikes there i checked the room key and there was no indication as to which hotel we were staying at my boyfriend and i did not remember anything else besides the brand name of the hotel when i was about to check my email receipt my phone died but we began to figure that we might be at a different hotel we started to lock up our bikes to go ask reception for help when i saw that our bikes said amsterdam city and the other student hotel bikes said amsterdam west this was the only indication that there were two locations and that we were in the wrong place it turns out we were,VADER
18,1,0,323,i seldom post an unfavourable review preferring to deal directly with the restaurant or hotel reference saturday we had occasion to overnight in dublin checked my favourite websites and for last minute price and location hotel seemed to fit the bill central and at very cheap indeed for dublin in july arrival our reservation made and paid for a few hours earlier was confirmed but we were asked for euros cash as a deposit for any room damage well travelled at years of age we were astonished at this request indicating that we were reluctant to stay at an establishment where the guests obviously trashed or ransacked the were advised that it was unusual for the charge to be levied but it was the managers idea and the reception staff could not get the policy were however advised that had we used an alternative website to book there would have been no charge which mystified us were given vouchers for a free drink at the bar at at check inwhen we looked at them later they expired at the room was adequate but when i dropped an earring on the bathroom floor i gave up the search early on as the discovery of a less than clean floor left me feeling a little illthe final insult came at checkout when we were advised that there was a chargeof two euros per bag if we wishedtoleave our small overnight bag with them for a few hours we felt sorry for all,VADER
19,1,0,330,the night before we were supposed to go to a wedding a large party was happening on the ground floor we were on floor at midnight the music started it was so loud our room was vibrating we called down to reception times but nothing was done at we went down to reception and finally managed to get moved to a higher floor it did help much when checking out we requested a discount the reception staff were rude and point blank refused saying it was there fault they then threatened to call the police if we did pay i do understand why this hotel thought it would be a good idea to put families and people who had a wedding the next day right above a party that does end until from the other side of the hotel the party could be heard the refurbished rooms are grubby at best and most of the hotel has tired carpets plaster hanging off the walls and looks a bit old and well used only saving grace the pool was nice but the chairs are grubby,VADER
20,1,0,350,unless you in town for a quick overnight you should find another option rooms totally outdated no air conditioning bad wifi connection no channel options on tv no ventilation in bathrooms worse coupled with hot week and no air expensive breakfast that is much better than a free continental breakfast no fridge in rooms front desk staff is friendly but did not get the same impression from the staff in the dubliner restaurant attached large amount of inviting seating space in the great because it much cooler than the rooms when it hot excellent concierge staff who help with the usual tourist stuff info about airport trips and getting taxis excessive bar smoke in the evenings if you staying in rooms with windows open above the restaurant,VADER
21,1,0,364,we booked our stay with and somewhere the information got lost we booked standard room with breakfast i need my coffee in the morning but the lady in the reception was telling us no she looked down at us the breakfast is keep that in mind even if you book it may not register and off course that not her fault but there is no need to make costumers feel ridiculous really what is when you pay a night so it not about the price but the way they carrying themself the room is clean but definitely not the room was well made and good condition but if the staff can not understand basic communication with customers then you are in great loss,VADER
22,1,0,366,picked as a relatively inexpensive option for one night prior to flying out of dublin so just looking for a basic place to sleep in a convenient location expected it to be noisy given the busy street did meet these expectations however a fresh coat of paint everywhere and a new mattress and pillows with even a bit of fluff to them would greatly improve the quality of the stay mattress was so saggy and lumpy that we could only sleep on the edges of the bed and pillows might as well have been folded blankets stuck in pillow case triple glazing on windows would also help,VADER
23,1,0,375,this hotel is located well outside the city center of amsterdam so that was a big draw back additionally the staff was incredibly unhelpful we accidentally booked this location and contacted the hotel immediately after booking to indicate our booking was a mistake they refused to issue us a refund or even allow us to transfer to one of the other nh hotels closer to the city center we offered to pay the difference in cost we just really did want to stay out there once we arrived and got in to our room there were peanut shells all over the floor and dark hairs on the chair and floor so the room had been poorly cleaned again the hotel staff at this point refused to help us by issuing a refund or allowing us to switch locations pretty awful experience the only good thing was the bike rental which we could have done at almost any hotel in amsterdam,VADER
24,1,0,422,being someone who travels extensively for work i can say i experience my fair share of dump hotels this place however tops them by a good way it pure nasty so where do i begin i start with minor grievance of only towel in a bed room i had towels in a no star hotel in lobito the front desk staff are not up to their job and are clueless could not offer alternative room when i complained at the rooms allocated small shoebox rooms with old and substandard furniture our daughters bathroom is smaller than our downstairs guest washroom so it a little on the snug side our rooms do have a fantastic view that is if you are an avid trainspotters and want to experience the closeness and rattle of speeding locomotives at all hours ah this city center hotel this normal and what you get was the sympathetic front desk reply the all day restaurant is all day if you exclude a large proportion of the day the photos on the website and booking sites must have been extensively airbrushed or outright doctored as even with lights off and a skin full of guinness would i be would be hard pushed to say the room is the one shown online to top it all they claim to have been awarded the hotel of in what way was that even remotely possible the only way i can get my head around that if if the catagory was the,VADER
25,1,0,442,we stayed at the stanley for nights it made us hate athens to be honest the location of the hotel and the rooms are not as they seem on the website we stayed in the executive room with double bed the bathroom was disgusting with old white shower curtains and you could hear everything going on in the next room while you in the bathroom there no ventilation and it just feels like you in a cheap hotel i did like it at all to be honest and felt it was unclean upon booking i thought that the hotel was in the centre and it not it mins away by car from the main streets in the centre syntagma square and monastiraki and you ca walk there because the streets around the hotel do look in addition to all this we were charged for a bill after we had checked out from the hotel and left for drinks at the pool bar where neither myself or my husband even checked out during our stay let alone stayed for drinks and when we requested to see the receipt it just had our room number on the top without even our family name or my husbands signature we told the hotel that this was not us and that we did even visit the pool and until now one week later the money had not been refunded never visiting this hotel again and i advise anyone going on a fun romantic trip to,VADER
26,1,0,449,the floor boards in the room were broken there was a bit of a funny smell there was free wifi it is located by public transport so getting in to the main part of town is easy the breakfast was not like you would get in canada or the usa ie it not like a continental breakfast i stayed here as part of a tour if i go back to amsterdam i will not stay here,VADER
27,1,0,516,loved the vat pub traditional irish music after from somewhere pounding driving music from nearby venue kept us awake all night long front desk was interested the next day when i reported it it more like a hostel taxi driver had had an ominous smirk when he dropped us off now i know why,VADER
28,1,0,536,on arrival at the hotel we felt we were inappropriately greeted at the front desk with an unwelcoming attitude in comparison to other guests checking in parallel to us who were provided with maps and received a friendly welcome on the first evening what should have been a relaxing bar experience after our journey was another disappointment the bar man focused his attention solely on mature american guests and ignored us when it was quite clear that we had empty glasses on our table and required service there was certainly no excuse for this as the bar was not busy in addition our bar dining experience was yet another disappointment having ordered and received our steaks they were both not done as requested in fact they were medium rare no service check was provided to enable us to easily rectify the situation one would expect this to be a natural part of the food service in a hotel of this standard worse was to come we attempted to order desert only to be told that the kitchen was closed again guests would expect to be warned of the impending kitchen closure whilst finishing ones meal so that any final orders could be fulfilled staff attitude and communication left a lot to be desired in this instance after receiving a lack of information at check in we approached a member of staff in the coffee area to enquire about hotel facilities however before he could ask him a question he stated,VADER
29,1,0,542,my mother and i chose this hotel for the end of our athens trip due to the price the hotel itself was fine very courteous and helpful staff moderately comfortable mattresses clean room the room was very much no frills with tile floor throughout and a miniature bathroom this being said location of this hotel is in a very unsafe block of town it is fairly close to a main street but i would never walk down those streets in the night and was uncomfortable in the day the closest underground metro station omonia is the most dangerous in athens we did know this about the area talking to many locals in restaurants and uber drivers confirmed how unsafe this area is if this hotel were transplanted to a safer street it would be the perfect basic affordable hotel however based on the location we do not recommend,VADER
