,predlabel,trueLabel,indexLocat,review,classification
86,0,1,1185,if i am back to barcelona i will visit this hotel again definitely i recommend this hotel if you are planning to visit barcelona but the noise of subway train was little bit annoying when i tried to sleep because i can feel and hear when the subway train comes near,VADER
87,1,0,1192,pretty disappointing my partner and i have stayed a few times and even though previously there were a couple of things that we considered not up to scratch we had relatively pleasant experiences after the last stay we wo be returning the first issue is the staff not true of all the staff members but most were generally rude entering and leaving the hotel was uncomfortable as some of the staff at reception did not make us feel welcome i do really appreciate being silently stared down as i walk to my room another issue was the relentless mini bar check while we occupied the room not a practice i expect from a four star hotel the problem with attitude among the staff became really evident when someone who came to check the mini bar while we were busy entered our room without making himself known there were a few times where someone entered our room without permission which was real invasion of privacy and then proceeded to move our belongings with his foot to gain access to the fridge all without saying much to either of us we made this incident known at the end of check out and they were obviously apologetic but during check out we were not asked how our stay was or if there were any issues and we were told we used an item of the mini bar when we had not which you think they know we did seeing as they checked so,VADER
88,1,0,1230,the bedroom was ok but the bathroom the worst one i ever used in a hotel the location is ok next to tube stations and min walking to the acropolis but the streets around were just ugly and i did feel safe the staff was nice and helpful i do recommend for people in holidays just for fast business trips,VADER
89,1,0,1242,we are currently staying at ofelias having just left the hotel catalonia barcelona around the corner where we had been for several days prior we made the switch to join friends staying at ofelias big mistake when we checked in yesterday we were given a small room with twin beds totally unromantic i immediately asked the front desk person tanya for a room with a king bed and she said that all the rooms have the same beds we discovered this morning that our friends had been given a much nicer room with a king bed desk view and balcony for the same price tanya had lied to us i hate being lied to we are very unhappy and wished we had continued our stay at hotel catalonia barcelona that hotel had beautiful large rooms with king bed extraordinary view much nicer breakfast large rooftop pool with a a bar and amazing views of the city,VADER
90,1,0,1267,positives are the hotel is very close to the acropolis and the new acropolis museum a minute walk will also take you to the temple of zeus and the stadium the plaka is a min stroll where you can find a range of restaurants and the typical tourist type shops in the oldest part of athens at the end if the plaka you will find the ancient agora the acropolis metro is only a min walk that will take you to other parts of athens the beds are comfortable and the rooms have air conditioning which is a must with the temps that can get to deg we had this for three days there is a small fridge situated in the bottom of the wardrobe but no facilities to make a cup of tea or coffee you have to go downstairs to the breakfast room in order to do so breakfast is rather tinned fruit that has been open too long and kept in a warm now fermenting the fresh fruit on offer was too ripe and spoiled and not enough choice coffee was via a nescafé vending machine tea is via tea bags and there are three types to choose from at least you can juice your own oranges with an electric juicer ask for a room that faces the inner courtyard otherwise you wo get a good night rest the hotel is situated on a corner of one if the busiest roads in athens you might want to,VADER
91,1,0,1280,first impression of the room was cool but the you start finding how dis functional the room really is there is no privacy from the bathroom to the rest of the room glass see through door and wall it was good for watching tv from the a very small mirror in cupboard to check your bathroom sink is in the bathroom it in main room but no mirror and no power point for hair straightener or electric shaver etc the power point is at the desk bellow the tv with a very small makeup poor lighting in the room which made doing makeup back and neck from bed and things were the staff were very friend helpful nespresso coffee in the room was a very nice to tram was great but next trip i will stay closer to city it was a little bit far out if you need to drop shopping off or get changed before going out for the area of vondelpark is beautiful in every way but more suitable for relaxing people rather than party people,VADER
92,1,0,1300,i stayed here in and the hotel was a great find back then i felt it was in a good location and the hotel was clean and modern however during my recent stay it was dated the bathrooms were the cleanest and the staff were not friendly the place has gone downhill there are also no safes provided in the rooms in a city with pick pockets galore you think this would be a standard amenity in a nutshell shame on you for claiming you are a star hotel,VADER
93,1,0,1330,we stayed here nights in an ocean side room on the floor of those nights two were disturbed by an extremely loud concert nearby which made it impossible to sleep the first went on until am the second is still going on but it is am as i write this and the music is still playing whee if you value your rest this is not the hotel for you,VADER
94,0,1,1345,the student hotel at amsterdam city was overall just what we needed at the end of our week backpacking trip we stayed nights there after traveling with backpacking backpacks hoping between hostels shared with people so we really appreciated the privacy cleanliness and an actual quiet and comfy bed however i do have two criticisms that i believe can be easily fixed firstly our room was never cleaned even though we put up the please clean our room sign not a big deal but just letting you know secondly when we rented bikes from the hotel and rode back after a really long day in the city we accidentally biked all the way to the student hotel amsterdam west when we tried to return the bikes we were sure why our bikes did match the bikes there i checked the room key and there was no indication as to which hotel we were staying at my boyfriend and i did not remember anything else besides the brand name of the hotel when i was about to check my email receipt my phone died but we began to figure that we might be at a different hotel we started to lock up our bikes to go ask reception for help when i saw that our bikes said amsterdam city and the other student hotel bikes said amsterdam west this was the only indication that there were two locations and that we were in the wrong place it turns out we were,VADER
95,1,0,1383,lets begin where our journey started we looked up the prices through and a dutch travel agent called tui the travelagent offered a superior twin room which was also a roomtype on the website it was combined with a flight the price was about the same so we booked trough tui when we arrived at the hotel it was very clear that the room that was booked for us was not a superior room but a standard room we tried to change this because we booked a superior room but according to the manager he offered this room as a superior instead of the real roomtype because of the company were we have booked the room this was unbelievable for us he just laughed at us and did nothing to help us with this problem he did not listen to our story but was only looking at the line with people who wanted to check out behind us because everything was full we had no other option to stay in the room is interior in a building it looks like a closet and does not have enough space for two persons who stay nights there is a semi double bed but this wasnt even close to the worst things every night we heard noises from the room next to us there are a lot of young people in the hotel that like to go out every night that fine and fun but when they came home at they kept talking,VADER
96,1,0,1411,used to be when you were in dublin the staff were extremely pleasant well at this hotel the staff act like kgb officials and are very rude they were intentionally rude to my highly educated daughter and i am a lifetime spg platinum meaning i have spent over nights on the road in spg hotels additionally on some very hot nights the ac did not work in the room and they put us in a tiny room all the while the staff acted like no big yes it is a big deal as our worldwide staff has been instructed that westin dublin is no longer a place they may stay vote with our wallets gm and as the chairman of a worldwide conglomerate i assure you no dollars will be spent at your this hotel much better options where the staffs are polite and respectful of a hotel doctor hit me with some love and a helpful vote,VADER
97,0,1,1414,we had the room with terrace is really recommendable only negative point roomservice is only until pm friendly staff public transport are easily accessible parking garage is directly under the hotel is with eur unfortunately not quite cheap,VADER
98,1,0,1447,at arrival we got some confused information that the first night our booking had been changed to a nearby hotel if we accepted these changes we were promised a compensation for this inconvenience the hotel also assured us that everything was taken care of no need for payment etc at the spare hotel despite the assurance from sansi diputació we were requested to pay at check out from the spare hotel both for the stay and the breakfast both already payed for at return to sansi diputació no one had any knowledge about the the discussions additional transport etc took significant amount of time and energy despite repeated contact from both our side and the hotel has not responded or given any additional explanations or apologies and we never saw any breakfast that you can add to your stay is not worth the money save this and buy your breakfast at some nearby café also recommend to avoid this hotel due to the customer treatment,VADER
99,1,0,1453,we stayed here for a night as there was an issue with a flood in the other hotel we were supposed to stay in this one the alexander is definitely the less nice one bathroom was old with mildew room was musty and carpet was old definitely recommend staying in the st stephens location over this one,VADER
100,1,0,1479,one of those hotels that if you do ask you do get if you do kick up a fuss on check in you will be given the smallest room on the floor as they try to palm it off on some if you do ask for your room to be fully cleaned you return on the night to find last nights mess still in your location is great staff are very friendly as you walk about and the rooms are nicely executed,VADER
101,0,1,1494,the hotel is right outside a metro station and about a block from a tram that takes you into the museum precinct they also offer small boat canal tours ppl from memory which are reasonably priced so you do have to do it on one of those larger touristy boats we went up the eastern channels around the zoo and ended up outside amsterdam centrale staion hotel is on the main road but as bikes are the main form of transport little road noise could be heard and nor were sounds from neighboring rooms present,VADER
102,1,0,1521,the front desk personnel was very friendly and accommodating that the only plus the wifi in the room was very slow it only works in the lobby and lobby is small and crowded the room is very very basic with no cabinets the mattress is thin and not comfy furnitures in the room are basic looks new but flimsy looking there no free breakfast as it says in it about per person but the food is good and considering it expensive to eat anyway outside we loved the coconut yogurt outside the hotel is a nice park that stretches couple of miles with nice restaurants and shops with lots of nice folks just hanging out not too crowded nice ambiance,VADER
103,1,0,1534,bad old value for qulaity wold definitely not go there again the staff was jjhghvvnm op b,VADER
104,1,0,1537,we stayed here for night in july the room was really small with a corridor for a bathroom no bath the shower leaked on the bathroom floor so we needed a towel to stop the floor getting wet small windows very small with a beautiful view of a drain pipe we had to shuffle things around and put things on the floor in order to use the kettle to make a drink on the up side the valet was really helpful allowing us to park on the front whilst checking in we complained about the room and were told that we would not be charged for the mini bar we had only had nuts and pringles but on arriving home they have been charged this was a special treat for my partner the room cost over which i was happy to pay but unfortunately just it did feel like a treat and also did feel like value for money also on the corridor we were on there was a funny smell but there was a sign saying apologies for building work staff were pleasant but overall for a star hotel was really disappointed,VADER
105,1,0,1561,worst breakfast i believe i have encountered anywhere in the world particularly in light of the star rating inattentive staff busy but not serving very poor cooked food quality undercooked bacon sausage with gristle unappetising scrambled eggs toaster not functioning resulting in long queues and wait time teapots leaking etc etcmanagement need to observe this towers experience and make rapid improvements,VADER
106,1,0,1562,i visited the skylon at the weekend for lunch with family we were heading to a big game in town so the skylon is an obvious choice for lunch have been visiting the skylon for many years the food and service was always great however a number of months ago they decided to no longer provide a carvery option for lunch that in itself is not an issue as long as the kitchen and servers can work together efficiently to get orders taken and food delivered you may have seen on my previous review since the upgrade that the service and food was very disappointing overall we hoped for a better experience on sunday but it was to arrived at and met friends who had got there before us their lunch order took minutes to arrive the food was only warm not hot our lunch took minutes to be delivered we almost had to cancel it as it was simply taking too hard to know where the problem is because there are lots of people serving in the restaurant my guess is that the problem in the kitchen the fact is the food was taking far too long to be delivered to lots of tables not just mentioned the skylon is well located to capture trade from people attending games and concerts in croke park however they do seem to be aware of this and are certainly not taking advantage of our food eventually arrived it was fine certainly no,VADER
107,1,0,1566,the hotel offers adequate rooms in a good location central close to transport shopping and various sites big minus we were charged twice for our two night stay we paid cash upon checking out and then our credit card was charged a few days later we are now aud plus card fees out of pocket if staying here be careful re payments also breakfast was crap,VADER
108,1,0,1567,good location seconds to grafton street very friendly front of house staff nice rooms although my room was on the small side and the room and bathroom could probably do with a refurbishment very nice lobby area and bar the letdown was the breakfast service with slow and very unfriendly service especially compared to other hotel staff on morning four i just got up and walked out after waiting min to try and order no hot buffet received an apology later and coffee in bar as compensation but then drink was charged on checkout,VADER
109,1,0,1572,sadly this trip was disappointing due to his hotel rest of dublin great but avoid his place sewage coloured water in bath unresolved even though changed rooms and only comp offered was a glass of wine could drink or use water in my room and had to wash using bottled water like on camp manager lady pleasant but ineffective in sorting base issue have never complained before but added to false alarm at this morning too no breakfasts for that price value for money want single people off,VADER
110,1,0,1576,stay of nights there as hhonors diamond you should be treated fairly unfortunately not at all no welcome for breakfast the hotel do a segregation of hhonors member on the underground with a limited food and untasteful moreover the staff is far to be professional and spend more time to chat and joke than take care of customer this hotel is not at all as hilton level and should be removed from hilton group,VADER
111,1,0,1581,we stayed for nights at metropolitan hotel in july hotel is undergoing renovation and that is needed it old dirty and not in a good condition right now if i had no other information i would rate it a star hotel one time when i tried to open the door to our room from the inside the door handle fell off the renovation was noisy the eggs in the morning buffet were rotten and the dinner on the roof top restaurant made my boyfriend and one of his kids complained about the noise and they moved is to a room a couple of floors up so they did try to help but it was still the this description you might wonder why we gave it two stars they are for the well equipt gym and the nice lifeguard by the pool one of the kids forgot her go pro camera by the pool and he saved it for her for the next day,VADER
112,1,0,1590,we have just returned from a a two day stay at this hotel this is the first hotel where staff do greet you and say hello no contact at all through the whole check in very clinical staff in the restaurant clearly had been trained in the same manner where is the warm irish charm the service was slow in the restaurant and the service was very disjointed the second night it was quicker especially when we asked for bill the bathroom was small the bedroom was clean and comfortable we had breakfast in the coffee bar in reception and it was fine sorry staff again ca take orders correctly and no interaction with guests would not be going back,VADER
113,0,1,1604,hotel mirabello is located at omonoia square which is the city center of athens and nicely accessible to metro and bus routes the hotel is in a small building but the rooms are of decent size and was very clean and the breakfast was of good quality but the space was quite small and at certain times it could be difficult to find an empty table overall i was happy with my only downside was the method of payment i booked from and i chose to pay at the property but the property had charged the first night without my consent it had not been indicated that the first night is charged in the booking and i was a bit upset about this confusion,VADER
114,0,1,1684,we booked nights at this hotel as my birthday treat we booked an executive room and i emailed the hotel to see if we could be upgraded as it was a special occasion i received a response to say the reception staff had the authority to do this on arrival the hotel was full this was the least of our problems the hotel website advises on the ways of getting from the airport to the hotel taxi at euros on our return to the airport we were quoted euros by hotel staff which we booked decided to take the metro as we thought euros rather expensive the metro was crowded and our travel paperwork and my husband passport were stolen from my handbag this resulted in a dash to the police station followed by a visit to the british embassy the following morning to report it and a return later to collect an emergency replacement day ruined and a nasty taste in the mouth regarding the city apparently this is a very regular occurrence and the passports are sold on to immigrants within executive room was nothing like executive the bath was very narrow and if you turned the bath tap fully on the overhead shower came on as well therefore the taps had to be turned only slightly on to fill the bath i reported this but the engineer could make no were replaced each day although the quality was not is unusual not to have facilities in a,VADER
115,1,0,1695,my family and i arrived at hotel after completing a wonderful stay in athens and a day cruise we checked our bags in at and then had a very full day in barcelona hotel was clean and modern and staff very kind we were located one level about street and our room was next to a very busy area noise was insane people party in barcelona that what was not ok was that room people yelling screaming and laughing until am i went down to the desk at and asked for a different room for the following night they said yes and i took my migraine and sleep deprived self to breakfast very nice breakfast be warned if it a weekend ask for a room away from the noise they should have asked me before sticking us in that room worst hotel experience in my many years of travel,VADER
116,1,0,1709,hotel location looks good so we booked may be the cheapest room because we only spent one night in athens the room was too small and did have any window its ok thats why it is the cheapest room but what about the towels their colour went yellow and smell very weird and the bed also smells like that just try another hotel there are many options in the centre of athens,VADER
117,1,0,1715,we stayed for a long weekend break our room was on the rooftop which was lovely bar the unclean jacuzzi which we could really use our main issue was that someone had been in our room on more than one occasion we had been out during the day our room had been cleaned with fresh bedding and toiletries lovely we then came back after being out for our tea and someone had been in our room and looked through our suitcases and bags this made us feel very unsafe and paranoid the second to last day when we came home after a day out touring the city the had taken one of our keys which we kept in the electricity port to keep the room cool with the air con our bags had been moved again when i asked reception why the key had gone she replied it happens sometimes i sure this should not happen at all i never been in a hotel where the cleaner or anyone else takes the key and you had your bags rummaged through we did eat in the hotel or use the bar the room was alright but we probably would stay again,VADER
118,1,0,1727,the hotel itself is quite nice and clean however when i arrived at my room was not ready and the staff took over an hour to get a room for me the staff clearly need training in customer service it is very expensive and in no way justifies the price i will not stay there again,VADER
119,1,0,1762,loud music until am every night no accommodations made to help filter the noise light curtain on window no air conditioner no sound insulation whatsoever at one point in the night i wanted to stuff the single bed mattress covers and pillows against the window to block out the noise all they gave was ear plugs our adult children were traveling with us and enjoyed the club the first night however they had an early flight out the second night and did get any sleep even though their room was around the corner from the was a real issue as we were aware of the fact that we had to park several blocks away with a discounted staff is courteous and very friendly rooms are dated but adequate,VADER
120,1,0,1766,the only pleasant part of our stay at hotel adagio was the location the room temperature controlled by the front desk for each floor was inconsistent and set in either extreme the wifi was spotty and never reliable which caused an inconvenience for travelers relying on that for access to maps etc the lobby and part of the hotel always had a very unpleasant odor and because of this we never cashed in on our complimentary tapas as to avoid sitting down there for a long period of time to top it all off we got home from vacation and realized we have beg bug bites all over again the location was great but i would recommend looking into other choices close by,VADER
121,1,0,1786,the air conditioning was not working very well it is hot in barcelona in july someone had been smoking in the room and the air unit was just circulating the smoke we both woke up feeling ill the sheets had holes in them and we were sleeping on box springs not a mattress we were each allowed one were very disappointed and tried to book another hotel but there was noneavailability the hotel was clean and the sangria was very good but notgood enough for us to be able to sleep through the night we were exhausted,VADER
122,1,0,67,it outside of the central after the bus or train ride still need to walk about min to reach the hotel imagine after a full day of touring still need to walk quite far it also not wheelchair nor stroller accessible makes it very difficult to travel with luggages,SVM
123,1,0,92,hotel is ok kind of location is not bad but not a walking distance from attractions rooms are quite small and breakfast is very basic i would explore another hotel if i go again to barcelona it has elevators one was down during my entire days stay staff are quite helpful with good english communication,SVM
