,predlabel,trueLabel,indexLocat,review,classification
123,1,0,799,motel one is far from the city centre and top attractions the central station is very far top attractions and canals will take you around minutes by the public transportation staff were rude no bath available just shower no iron or british electricity adaptors were given rooms were too small keep your passport and money in safe place as no deposit safe was there it is simply a motel not hotel i misunderstood the motel facilities due to reviewers comments and i made a wrong decision if i will be going to amsterdam again i will go for another option,SVM
124,1,0,823,noise from other room is so big that i could sleep well every some water that where it came from are all around my shoes so my new shoes from barcelona became wet two things above was bad but other things about the hotel was good,SVM
125,0,1,836,i booked this hotel mostly based on price and location we were in dublin for the concert and visiting the city for the first time so i wanted something affordable yet centrally located so we could get where we needed to go without spending too much on taxis the hotel was great there are four of us two tall teen boys in tow and i wanted to be sure we were stacked on top of each other i read reviews of the family room in this hotel and hoped it would live up to our expectations it did and then some upon arrival we were told it would be another hour before a room was ready fine since it was well before scheduled check in i pause the review here and note to first time overseas travelers from the us that flights arrive in the morning but the hotels are always able to accommodate you until their scheduled checkin no matter how high priority you have in a rewards program getting angry at the hotel staff for this does no good and just adds to the reputation americans have of being arrogant travelers we saw this again upon arrival at this hotel americans angry that no room is available at am checkin is clearly noted as pm if your flight arrives at am and you want to be in your hotel at am you need to book it for the night prior if you can not do that then do,SVM
126,1,0,861,for being a hilton hotel you expect high and good service when the prices are that high forgot our orderlazy in the barservice remote did worktook the freedom of giving us the most expensive alcohol in the drinks without askinggave us the wrong billthe staff were friendly but should maybe have a lesion in hotel service not worth the visit,SVM
127,1,0,902,the temperature outside is and there is a tiny window in a room for four if one person takes a shower the room is too warm if two take a shower it a sauna for the rest of the night i have encounter the little window phenomenon throughout ireland but his huge monster of a hotel is hot throughout sleeping happens after he room has cooled down around stick to airbnb most homes and flats have actual portals to the outside air,SVM
128,0,1,918,we came to the hotel at when check in is at was told that there are any issues with our room so we went for lunch and came back at room was ready on time was asked to come back at we are busy was the explanation we got nothing alse we thought that it should be reasonable to have been compensated for that but did ask for nothing i think that when paying this much for a star hotel they have to do more to make your customers happy when you messed up i sure that if i did check out on time i would be charged for it and so if my room was ready on time the same rules should apply,SVM
129,0,1,942,i stayed with a group of teenagers with a travel company and i was surprised how calm the atmosphere was in the hotel the reception wanted us to fill out paperwork to figure out the tourist tax when we were trying to get our group settled and organized in their rooms but they let us come back later and figure out the bill the rooms were always cleaned well and the reception put in a call for me and called a taxi for me when i needed to go to the thought that there would be more craziness since it close to la rambla but it was quite the opposite i ca say that i felt unsafe at any point but there were some weird people outside i feel like that is almost everywhere near the city center but i think it important to note if you stay there i never felt unsafe but the people were strange also please note that the download and upload speeds are very slow if you need to upload download or transfer files on business then you might want to consider another hotel i had to try uploading pictures through dropbox and it would take an hour instead of which is the typical time for the amount of files i was working with at the time,SVM
130,1,0,947,this would have been good for a hotel but not for hilton top of the line we stayed for three nights and the experience was a let down two nights there was no turn down or attention to the room the concierge service ranged from outstanding to i ca be bothered but the front desk was outstanding two out of three breakfasts were terrible the buffet items were outstanding but after seating and the initial coffee the wait staff had to be called they never would come back to check to see if we needed anything that was not on the buffet i felt they may have been shunning staff at lemuel bar and lounge generally did a good job,SVM
131,1,0,1102,the only good thing about this hotel is its location rooms are very small and becomes congested if you have even a little luggage very few options for breakfast wifi was bad especially in the floor,SVM
132,1,0,1111,the beds were decent the bathroom was worn with rust and discolored tile grout but it was all functional and very important for us well working ac the wifi however was painfully slow a limit of only devices was certainly an issue for us as we had to take turns getting on it,SVM
133,1,0,1154,the only pleasant part of our stay at hotel adagio was the location the room temperature controlled by the front desk for each floor was inconsistent and set in either extreme the wifi was spotty and never reliable which caused an inconvenience for travelers relying on that for access to maps etc the lobby and part of the hotel always had a very unpleasant odor and because of this we never cashed in on our complimentary tapas as to avoid sitting down there for a long period of time to top it all off we got home from vacation and realized we have beg bug bites all over again the location was great but i would recommend looking into other choices close by,SVM
134,1,0,1157,i travel a lot and stay in a lot of hotels that carry stars unfortunately in my opinion herbert park is at most when i moved into my there was silicone falling off in pieces above the mirror in the bathroom the wooden panel that covered the bottom of the tub was splitting and paint was chipping the pillows smelled in one of the hallways the wall phone was hanging by the wires etc i was moved immediately to a different which was little better but still faced the same issues i do have to give some credit to the staff everyone was friendly and the cleaning staff was superb all rooms need a face lift or a star needs to go,SVM
135,1,0,1183,no longer a doubletree hotel very disappointed with this hotel it is modern in design but lacks character we found the front desk staff to be rude others in the hotel ranged from pleasant to unpleasant charge daily for parking and breakfast is euro it is away from city centre so you will need to take transportation into the rest of dublin a bus stop is outside the hotel but the staff was not at all knowledgeable about the routes rooms were hot and had poor ventilation there was a portable air conditioner in the room but it did not perform well enough to cool the room even opening the windows would not bring in enough cool air,SVM
136,0,1,1202,the hotel is very well situated the room was nice and simple with a big smart tv and the staff was great however i was disappointed with my poor late night dinner ordered some pasta with tomato sauce but they tasted really bad,SVM
137,1,0,1213,i made the booking at athens lotus hotel and mentioned that we will arrive by am from the airport however we arrived and they informed us the hotel full and they can not give us the room until pm we are honeymooners and did sleep since two days arrived the hotel so tired but unfortunately the receptionist was a bit tough and she could show any kind of helpful no sofas or any place to have short nap we were extremely tired so we slept at the chairs at the lobby few people checked out front of our eyes requested to have their rooms but they refused the first day in greece and the first hours in athens was as expected because of them were planning to have some rest and go around the city afternoon but they destroyed everything up for us,SVM
138,1,0,1340,very disappointed to have had such an experience when you pay around the rooms are new and a confortable bed and big the room service is very good level and people very kind the plates could be more elaborated for a they remain very the breakfast is the service must be ameliorated you must run to have your coffee and your bill to in this category of are supposed to serve you the orange juice too the room cleaning service is a real disaster due to which i would never suggest this hotel or come back pillows which smell floor not cleaned coffee which is absent paper absent people who enter to the room despite the privacy laber put outside too many mistakes for a hotel of such a category very disappointed,SVM
139,0,1,1354,location one block over from sagrada quiet supermarkets restaurants and pharmacy design of hotel limits noise outside rooms center space separates sides of corridors small bistro offering food until late staff staff staff amazing cons not suprising for ibis hotel though no kettle in the no safe in the room,SVM
140,1,0,1407,shame they did not warn these young people in a graduation came at to and they charge thème an additional night absolutely unfaithfull way to make money on the back or young and unexperienced people do send your kids,SVM
141,0,1,1411,me and my family staying here for night we wish we could stay longer but the hotel is fully occupied we experienced very good service and at the same time very bad service during joana was very helpful she showed us our options in our first night we orders room service we were very disappointed with our room service our club sandwich was missing tomatoes bacon and very little lettuce it was basically only cheese and small meat in bread our pasta was missing parmesan it our chicken sandwich was good fausto was very helpful during this issue and made us feel like proper next day we had called at times to have our room serviced returning after the beach at to find our room still very dirty was the worst part of our after we called again it still took hours to have our room clean at that time is was already maria was very helpful with delivery our ice which we waited over minutes pool staff was always in the back room therefore it was hard for us and other guests to obtain towels and order we enjoyed this hotel we want to recommend this hotel although there are a lot of device to fix it seems like the ma agents and higher staff hide in the back while getting the interns and other lower staff to complete missed jobs,SVM
142,0,1,1493,our experience with the roger de lluria was generally consistent with the positive reviews on tripadvisor as my wife our two adult daughters and i were going to be in barcelona for only one night i wanted a convenient location in the heart of barcelona i was already familiar with the area having previously stayed multiple times in a nearby hotel this time i wanted a somewhat more elegant place and the roger de lluria seemed to fit the bill i booked two double rooms for a sunday night and requested twin beds high floor and facing the street on the friday before our scheduled arrival we decided to arrive a day early my daughter called the hotel and asked if there was availability the next day the answer was no but a few minutes later the desk clerk hakim called back to say they could provide two rooms for the first night although he warned they would be smaller and not as well located as the rooms we would have the second night unfortunately the price would be the same as for the better and bigger rooms euros per room per night but hakim said he would include breakfast for the first morning therefore even before our arrival we had a sample of the friendly and helpful service provided by the hotel staff and after our arrival there were other examples i had parked my car a couple of streets away see why below and asked if it was,SVM
143,0,1,1533,after doing on line check in on arrival on a hot day i had a room with no air con not feeling very well i asked the front desk if they could change room the lady apologised and moved me room the room was very clean and ideal the building work did impact as it is during day time location for work is great this is much better hotel than the sister doubletree hotel by miles and in a better location breakfast i was surprised as normally breakfasts in garden inns are not great this was very good,SVM
144,1,0,1550,i would like to firmly voice my disappointment and frustration with this sons were traveling alone to amsterdam for the first booked a reservation on july a week before their travel date directly from the website and received an email guaranteeing our my credit card company flagged it as fraud activity and put a hold on the contacted my credit card immediately and assumed that the charge would be of sending us an email to inform us of the denial the establishment cancelled our reservation once again without informing us of this event this left them stranded in amsterdam on the scrambling to find a hotel where there was availability for days as you know that is not an easy feat and the reason that we booked a week in advance they eventually had to take a lesser hotel with a higher a sad first experience for two novice travelers,SVM
145,1,0,1585,room was reasonable but not worth the and per night shoddy repair work throughout broken mirror covered up with piece of new mirror shower head moving in and out of the window could not be opened very much so the room was very could be best described as disorganised with large amount of tables left unclean after the previous park on arrival day there was plenty of space having returned day i was forced to park on street as the car park was full of match patrons as pay parking commences at i had to relocate my car the following morning at to the hotel car park which when checking out i discovered that they attempted to charge me for x car park stays at a cost of not a good example of a dublin hotel therefore i will chose a different hotel next time,SVM
146,1,0,1657,we booked our room at the hotel through secret rooms and were promised a star hotel in a central hotel is definitely not star the rooms are very dated and small and are desperately in need of refurbishment what was supposed to be a double bed was singles pushed are a few positives the staff at the hotel are very polite and friendly the location of the hotel is excellent within walking distance of the beach and most major attractions unfortunately this does compensate for the hotels faults our room was cheap for the nights we stayed i would stay here again,SVM
147,0,1,1707,rooms are not very clean bathroom looked brand new kettle hair on sunday night but i knew that as it was mentioned on the web beer garden and sports bar next is included in murray s staff are irish you,SVM
148,1,0,1742,good things good location ner subway and la rambla quite cheap hotel bathroom quite fresh and they cleaned the room everyday friendly staff cons our specific room had a not so modern design with old furnitures and had not been renovated for many years also very noicy from the streets outside and the other hotel rooms not soundproof at all but this mainly bothered us during the weekend and not the weekdays when you use the bathroom there is zero soundproof for the rest of the hotel get what you pay for and we think it worked quite well since we wanted something cheap and central,SVM
149,1,0,1776,easy access to all the sights and temple bar shopping cathedrals castle but clearly not worth the price felt like a very low rate motel when there are plenty of other options in the area that are much nicer,SVM
