,predlabel,trueLabel,indexLocat,review,classification
124,0,1,145,stayed here for nights for work and whilst the location is superb the room are looking very tried there really needs to be a makeover here as when you enter the hotel the downstairs lobby and bar area look very nice and inviting if a makeover is not performed soon then i can see this hotel losing out on even more business having said that the buffet breakfast was ok the items were crammed down to the one end of the restaurant where there was not enough room to be able to cook your toast etc whist other people wanted to grab some butter jam and other breakfast items the cooked breakfast i had on my last day was oright but i have had a lot better they seemed to want to present it in a fancy way rather than actually giving you a decent hearty breakfast myself and colleagues were not the only ones commenting on this i would stay here again purely due to location and would hope the hotel manager takes onboard some of the guests helpful comments i did find the lobby staff very welcoming and friendly,SVM
125,1,0,152,when the best thing you can say about the hotel is that you liked the front desk staff know it not great truly the guys at the front desk were very helpful and professional we booked an eight day greek vacation after backpacking and self guiding ourselves through italy for weeks through an aegean travel agency we had two nights in athens before heading to sifnos and serifos islands and then one night in athens again before ending our trip we were picked up at the airport and transferred to hotel economy by a great taxi driver i guess we should have known by the hotel name what kind of place it would be first of all it basically in the red light district as i would call it there are therese two minutes in any direction the hotel is very dated the beds are hard and the pillows are harder the bathroom is barely big enough to change your mind they could use plastic shower curtains you flood the bathroom when you shower thank goodness for drains in the floor you have to sit on the toilet to shave your legs actually sort of handy the refrigerator does work when you leave the room it connected to the key so there no chance to have cold water when you return from your shopping or tour it very noisy outside as well as above you the continental breakfast starts ta that late if you from the us it a pretty,SVM
126,1,0,187,be aware this hotel has two small rooms on each floor which do not have windows to the outside they have small windows that look out into a very dark small open central lobby it is our first time staying in hotel with no windows to the outside we were unlucky enough to get one of these try to sell you on their buffet breakfast euros reduced to euros if you book breakfast for the entire stay bear in mind that you can get a baguette sandwich plus a coffee for about euros from any of the little pastry shops around the hotel we did bother with their breakfast option and were glad we front desk staff is especially this one lady who works nights the only helpful person we found was maria who was very gracious and helped us with check out,SVM
127,1,0,204,came to dublin as a treat after recovering from an illness our room was shabby with the formica peeling off the furniture stains on the lampshades and grouting around the bath discoloured the air con was outdated and noisy the shower was extremely low powered the room was at the back of the hotel on the ground floor with virtually no natural light getting in therefore had to have the light on all the time how depressing large blue bins for refuge collection were lined up right outside our window the breakfast was just ok the housekeeping staff were very pleasant and courteous as were the staff in mcgettican cookhouse the food here was very good and great value,SVM
128,1,0,219,first the highlights updated hotel with comfortable rooms and a great breakfast in a great neighborhood secondly the disappointments as a gold honors member and mile flier i have stayed at a few international hotels the staff never quite got all of the amenities in my room right each day no new coffee most days bathroom amenities missed most days daily water was hit or miss on my last day of i asked for water to be replaced and was told the hotel policy was water only on the first day of arrival really this is the first major brand international hotel where i found the complimentary water rationed to one day i explained my concern to the staff and they had no answers penny wise pound foolish i will not be back,SVM
129,1,0,296,maple hotel was an uninspiring experience ok the location is good but that is the only positive response i can give we had a double the size of a cubicle one had to sit in the bed while the other we were on the first floor facing the heavily trafficked street thank god we had earplugs,SVM
130,1,0,387,we booked this hotel on short notice as it came up first on we thought it would be close to town and we could walk to the main attractions as we only had a short stay in athens this was not the case and it was very complicated to get anywhere without a taxi and most of the drivers do not understand english the hotel is situated near a district so that should be taken into consideration very difficult to cross the road as it is a four lane highway out the front with a fence in the midway the hotel is very new but very badly designed and finished off very small lifts to take you to the rooms so it takes two trips if you have a lot of luggage we ordered some food from the restaurant and bought it up to the room unfortunately my food had an eye lash in it generally the staff was very friendly though check in did take some time which i do not really appreciate the hotel finishes and location lets it down i would not recommend or stay here again,SVM
131,1,0,406,the honest of the assistant service personal is questionable i lost an important mount of money of my room and they didnt anything to find it i make an pólice report in the pólice station and i waiting the results,SVM
132,0,1,412,wonderful most european rooms are small i was on my own and got a single it had a sauna and a whirlpool tub when i was there it was very hot the room did not have ac and there were concerts going on so there was a lot of traffic with cars and people walking around partying i had to leave the window open so did not sleep for almost nights i stayed i asked to be moved but no availability on night begged for a fan or something or i was going to find other accommodation i feel i should not have had to ask for one but offered so i could close the window for some quiet otherwise it very conveniently located and the tub was great after long days of walking and hiking,SVM
133,0,1,427,our experience with the roger de lluria was generally consistent with the positive reviews on tripadvisor as my wife our two adult daughters and i were going to be in barcelona for only one night i wanted a convenient location in the heart of barcelona i was already familiar with the area having previously stayed multiple times in a nearby hotel this time i wanted a somewhat more elegant place and the roger de lluria seemed to fit the bill i booked two double rooms for a sunday night and requested twin beds high floor and facing the street on the friday before our scheduled arrival we decided to arrive a day early my daughter called the hotel and asked if there was availability the next day the answer was no but a few minutes later the desk clerk hakim called back to say they could provide two rooms for the first night although he warned they would be smaller and not as well located as the rooms we would have the second night unfortunately the price would be the same as for the better and bigger rooms euros per room per night but hakim said he would include breakfast for the first morning therefore even before our arrival we had a sample of the friendly and helpful service provided by the hotel staff and after our arrival there were other examples i had parked my car a couple of streets away see why below and asked if it was,SVM
134,1,0,460,it is a shame as the staff work so hard to assist and make your stay enjoyable but the constant construction works and noise is off putting from early in the morning into the evening hammering drilling workmen shouting and banging of doors it is near impossible even to take a restful hour in your room during the day as it is located on a very busy main street with bars and clubs and an outdoor concert venue just down the street people party literally to the crack of dawn so expect to not have a decent of the works the rooms was too warm as the ac is not functioning all making for an exhausting stay on a good note the breakfast is plentiful and fresh,SVM
135,1,0,471,rooms are tiny no privacy glass doors on en suite rooms very noisy can hear everything from room next door waited mins to be served at bar gave up went down the street to a supermarket bought our own drinks great restaurant next to hotel,SVM
136,1,0,477,i was dissapointed with the service we was stay four wasnt redy for wasnt enough towel and bath producs even service was verry am never dissapointed with any hotel ike this before,SVM
137,1,0,543,let start with the positives friendly helpful staff great welcome cloud pool good food lovely place to chill out in the evening and barman chris was fabulous pool good toolocation mins from alimos marina so handy if you hiring a yachtthe tv worksso the negatives we booked a family room and got two rooms not interconnecting ok for us as we have teens but not great for younger rooms were functional at best decor dated patched up in places and they reeked of cigarette smoke shower woefully inadequate fell out of its holder several times bulbs missing it on a very noisy main road despite double glazed doors and seemingly some rooms have thick blackout curtains and others not breakfast basic meat cheese bread yoghurt etc all ok but overcooked cooked breakfast fried eggs like booked through ba and the reviews were ok but seriously this is a very basic hotel we were here less than hours and that was hours too many,SVM
138,1,0,574,hotel is older but clean cozy yet comfortable we were looking for a place to lay out heads this fit the bill price was good you get what you pay for like the big bang theory the elevator does not work but we knew that ahead of time this hotel is in the heart of the temple district with shops bars and numerous restaurants just outside the door we found all forms of transit within simple walking distance staff is friendly no early checkin,SVM
139,1,0,687,we had an issue with payment checking in and even though we had the money and sorted it in the meantime staff were incredibly rude and laughing at us in dutch not knowing i a fluent speaker no food facilities and area is barren other than a small spar supermarket and sloterdijk hotel could have been cleaner but overall would recommend if it was for the terrible customer service,SVM
140,1,0,704,stayed here at the start of july when we arrived after we payed and asked for a receipt but we were told we would recieve the receipt as we checked out at the end of the week we were then told our room was ready and we could check in until when it states on the website that we should be able to check in from onwards when we checked out they tried to charge us again and we had to show that they had taken the money on our banking app otherwise the stay was pleasant and the hotel is in a good location,SVM
141,0,1,707,nice pool at the last floor staff very nice but not worth the price you payis not possible to smoke at night in the rooftop because it became restauant they gaved me the room before check in time so i appreciate it,SVM
142,1,0,759,for being a hilton hotel you expect high and good service when the prices are that high forgot our orderlazy in the barservice remote did worktook the freedom of giving us the most expensive alcohol in the drinks without askinggave us the wrong billthe staff were friendly but should maybe have a lesion in hotel service not worth the visit,SVM
143,1,0,789,when i got to the hotel i was amazed by the beautiful modern and clean smell of the lobby that image was destroyed when i got into the room the carpet was filthy full of stains and the humidity smell was awful the ac did work which made the humidity worst i was changed twice to different rooms but the problems were the same at midnight one of the front desk guys came and advised me they did have any ac i finally quit and tried to enjoy the stay peter from the front desk was very helpful and nice to even gave us good recommendations to enjoy the city which we loved despite the hotel rooms breakfast is varied and good restaurant food is delicious expensive though,SVM
144,0,1,873,when we arrived at this impressive hotel we were thrilled when given an upgrade to a suite sadly the aircon did perform very well so our room was constantly very hot we notified staff and although they initially came to check obviously there was a fault breakfast which we had included was magic served in the winter garden room we loved our start to the day and enjoyed the luxury our suite was massive so enjoyed the space great location as the downside we were evacuated late one night with warnings to leave immediately and do not use the lifts already in bed threw some clothes over the top and only took long enough to grab passports many guests some quite panicky raced down the fire escape to the street where you would expect to see a staff member to direct us no no one was there we all gathered waiting for instructions eventually we decided to go to the front of the hotel to seek help the hotel seemed to be fine with other guests inside unaware obviously the wing we were staying in was the only area i queried staff as to when they were going to let us know we were safe to return to our rooms they informed us it was no big deal and all was not good hotels should have an obligation to their guests and their safety,SVM
145,1,0,896,we stayed nights on arrival no offer of any help with the bags and it only got worse staff decidedly unhappy in most areas breakfast was busy but again staff inattentive the hotel itself was tired and clearly ready for redevelopment which was happening on almost every side of the hotel avoid if possible as there are much better hotels nearby,SVM
146,1,0,899,very nice view from the heat in the elvators the need to wait around minutes to the working at the reception think that they are doing you a favor by staying at their hotel they forget that the guests are paying their salaries,SVM
147,1,0,910,i stayed for nights in this hotel great location on the corner of la rambla many restaurants and shops in front of metro station and min walking to room is old and dusty the ac is too noisy the bed is hard and not comfort at all and the staff is not friendly,SVM
148,1,0,958,maple hotel was an uninspiring experience ok the location is good but that is the only positive response i can give we had a double the size of a cubicle one had to sit in the bed while the other we were on the first floor facing the heavily trafficked street thank god we had earplugs,SVM
149,0,1,1008,clean rooms and very good the internet speed was not good enough and there was no option for premium paid your room is looking to the avenue the noise good be significant,SVM
150,1,0,1057,had high hopes for this hotel but it was at best described as adequate loud vicinity appreciate that the hotel can only do so much to address this but more could be done in terms of the decor worn out carpets on the stairwells and very low budget shower curtains that stick to you you know the ones polite enough staff but they have an air that they are just going through the motions did find them very genuine it a shame as this place could be so much more,SVM
151,1,0,1075,we was here last year and it was amazing but this year we are shocked from the room services its really bad sheets not changed cups not changed or cleaned and we complained the first day but nothing happened the second days we found everything the same so we decided to move to another than this the hotel was good,SVM
152,0,1,1094,overall the hotel is tremendous i did not give a for a couple of reasons the front desk staff is not very friendly and in particular francesc was condescending both on the day we checked in and the day we checked out overall that did not affect our experience much but it is something they could work on none the less also the housekeeping staff was very pleasant but only of days did we have turndown service which again not a big deal but is part of the price also two of the days we returned from our long day outside the room and at it had not been made up this was annoying because the cleaning cart was camped outside our room all day everyday yet our room is last i tip the cleaning service everyday so it could not be that it probably explains our difficulty on the first day we got there at and asked if early checkin was possible the woman at the desk said the cleaning people are outside your room now so it should be an hour or less well we came back in an hour and a half still not done this was the time she reminded us in a teachy condescending way that time is uh we know you told us we could check in earlier so we left and came back at around still not done this is when francesc mansplained that the check in time was so we knew that,SVM
153,1,0,1114,this was my trip to barcelona and this is my personal experience i have been in hospitality management for over years i am always willing to bend break the policy when it comes to legitimate human life issues of my i prefer to cultivate a relationship based on trust and return business with my clients on july we had a family emergency but even after explaining the situation were denied a refund for the nights stay on the that we could not use as we had to fly back home to on this personal experience when i return to barcelona in i will book elsewhere,SVM
154,1,0,1131,noise from other room is so big that i could sleep well every some water that where it came from are all around my shoes so my new shoes from barcelona became wet two things above was bad but other things about the hotel was good,SVM
155,1,0,1132,we had the displeasure of staying at his hot er place you could call it while on a transfer from athens to beirut we had to walk up several flights of stairs and wake the reception guy up so he could check us in he checked us in topless which was in our early expectations of the place the room was cheap and big however the next day we discovered several cockroaches were on the ground beside us when we woke up we had a fan to help air the room but to be honest we were happy to leave the room at any chance we got we were planning to stay there again on our return transfer back to dublin but we cancelled and booked another place which was a lot better avoid if you can unless you are happy sharing with uninvited cockroaches otherwise you love it,SVM
156,0,1,1143,i stayed with a group of teenagers with a travel company and i was surprised how calm the atmosphere was in the hotel the reception wanted us to fill out paperwork to figure out the tourist tax when we were trying to get our group settled and organized in their rooms but they let us come back later and figure out the bill the rooms were always cleaned well and the reception put in a call for me and called a taxi for me when i needed to go to the thought that there would be more craziness since it close to la rambla but it was quite the opposite i ca say that i felt unsafe at any point but there were some weird people outside i feel like that is almost everywhere near the city center but i think it important to note if you stay there i never felt unsafe but the people were strange also please note that the download and upload speeds are very slow if you need to upload download or transfer files on business then you might want to consider another hotel i had to try uploading pictures through dropbox and it would take an hour instead of which is the typical time for the amount of files i was working with at the time,SVM
157,0,1,1154,wanted a change from the usual hilton type hotel and chose the morgan because of ta reviews and location this is a small boutique style hotel with luxe fittings and furnishings however all is not what it seems if you look closely the place is starting to look tired the phone in my room was of the euro variety and the carpet in my bedroom is beginning to look grubby amongst a whole host of small things this place needs a little time and attention spent on it by the owners complete with a new lick of paint otherwise they will kill off what is essentially a lovely funky place to stay oh and one final thing the buffet breakfast needs to improve frequently running out of sausages and bacon an omelette stations would also not go amiss,SVM
158,1,0,1158,stayed for one night the hotel looks good from the outside and reception area but as soon as you go in halls leading to rooms its like you stepped back in time to the rooms very dated we booked an executive room only difference it seems was the bed was bigger building site to the rear of the hotel so its very noisy from,SVM
159,1,0,1161,super expensive hotel and inflexiblenon smoking room smelling smokehalf a soap in the roomparking too far awayno breakfast before am without breakfast basketi do recommend this hotel it is abusing of its location,SVM
160,1,0,1242,we are currently staying at ofelias having just left the hotel catalonia barcelona around the corner where we had been for several days prior we made the switch to join friends staying at ofelias big mistake when we checked in yesterday we were given a small room with twin beds totally unromantic i immediately asked the front desk person tanya for a room with a king bed and she said that all the rooms have the same beds we discovered this morning that our friends had been given a much nicer room with a king bed desk view and balcony for the same price tanya had lied to us i hate being lied to we are very unhappy and wished we had continued our stay at hotel catalonia barcelona that hotel had beautiful large rooms with king bed extraordinary view much nicer breakfast large rooftop pool with a a bar and amazing views of the city,SVM
161,1,0,1267,positives are the hotel is very close to the acropolis and the new acropolis museum a minute walk will also take you to the temple of zeus and the stadium the plaka is a min stroll where you can find a range of restaurants and the typical tourist type shops in the oldest part of athens at the end if the plaka you will find the ancient agora the acropolis metro is only a min walk that will take you to other parts of athens the beds are comfortable and the rooms have air conditioning which is a must with the temps that can get to deg we had this for three days there is a small fridge situated in the bottom of the wardrobe but no facilities to make a cup of tea or coffee you have to go downstairs to the breakfast room in order to do so breakfast is rather tinned fruit that has been open too long and kept in a warm now fermenting the fresh fruit on offer was too ripe and spoiled and not enough choice coffee was via a nescafé vending machine tea is via tea bags and there are three types to choose from at least you can juice your own oranges with an electric juicer ask for a room that faces the inner courtyard otherwise you wo get a good night rest the hotel is situated on a corner of one if the busiest roads in athens you might want to,SVM
162,1,0,1280,first impression of the room was cool but the you start finding how dis functional the room really is there is no privacy from the bathroom to the rest of the room glass see through door and wall it was good for watching tv from the a very small mirror in cupboard to check your bathroom sink is in the bathroom it in main room but no mirror and no power point for hair straightener or electric shaver etc the power point is at the desk bellow the tv with a very small makeup poor lighting in the room which made doing makeup back and neck from bed and things were the staff were very friend helpful nespresso coffee in the room was a very nice to tram was great but next trip i will stay closer to city it was a little bit far out if you need to drop shopping off or get changed before going out for the area of vondelpark is beautiful in every way but more suitable for relaxing people rather than party people,SVM
163,1,0,1300,i stayed here in and the hotel was a great find back then i felt it was in a good location and the hotel was clean and modern however during my recent stay it was dated the bathrooms were the cleanest and the staff were not friendly the place has gone downhill there are also no safes provided in the rooms in a city with pick pockets galore you think this would be a standard amenity in a nutshell shame on you for claiming you are a star hotel,SVM
