,predlabel,trueLabel,indexLocat,review,classification
0,0,1,6,good location good breakfast which is included good wifi and tv pity they dont offer a buffet meal too especially on sunday night when there is nothing worthwhile to eat in this area without getting back on public transport only negative is no fridge,VADER
1,1,0,33,booked this based on the beautiful best western we used in london nothing like it do trust brand name terrible area did feel save old shabby hotel no help with luggage up to room smallest bathroom i ever experienced only thing that was okay was the breakfast wo be back there,VADER
2,0,1,50,the hotel was nice and modern the restaurant was also very good the public transportation is right outside the hotel which is convenient but i did realize it was really downtown we walked downtown and it was a minute walk the round trip public transportation price is about per person or all day the staff gave us bad information about the taxi to the airport though said they take credit cards they did not and said it would be to depending on traffic but it cost we had to run inside and pay the fee at the atm to pay the taxi driver this was a taxi that they booked for us,VADER
3,1,0,59,i think this hotel is too pricey for what it offers it is placed in a very dirty and crowded zone the rooms look old and need updating the room assigned to me smelled like someone had smoke in and it is a was extremely noisy the hotel and outside super noisy all the time i do understand the prices we pay compared to the quality of the experience it speciallymakes me wonder who works there and if they can be trusted as they do not have respect for the comfort of guests the sheets had little wholes in many places the floor was scratched a lot i sensed a really bad smell in the halls one of the receptionists was cranky and moody when people requested things that do match what he wants but are normal people requests i sense some entitlement here that needs them to be reminded of who paying i mean if they ask for so much money they should care about people and listening to them i do need rudeness or crankiness if i paying for a service if you do like your job please change it i insist that the price is too high,VADER
4,1,0,92,hotel is ok kind of location is not bad but not a walking distance from attractions rooms are quite small and breakfast is very basic i would explore another hotel if i go again to barcelona it has elevators one was down during my entire days stay staff are quite helpful with good english communication,VADER
5,0,1,103,we stayed one night and had two rooms for people rooms were spacious and comfortable did not eat at the restaurant because the breakfast price was outrageous within a minute walk to one of the hop on hop off bus tour stops which was convenient for us do even think about getting laundry done price is per item for a pair of underwear to be laundered hotel is in a quiet residential neighborhood,VADER
6,1,0,117,after much thought my daughter and i decided to meet in athens greece for our first european vacation my daughter lives in south korea and i live in new jersey we thought it would be the perfect vacation we planned it for months and decided after much investigation to stay in the melia in athens greece our flight transfers and all of our plans went perfectly except for our choice of hotel there were many issues with this hotel the internet did not work well the room was not very clean the shower was moldy the blow dryer did work and when it was replaced we could use it in the bathroom we had to use it over the vanity and it did not have a cord long enough to reach over the vanity to use it but that was nothing in comparison to the security issue that we experienced an electrician from the hotel entered our room without any notice to fix the internet that what the management at the hotel said this worker proceeded to leave our room with the door propped open he said he had to check something n the basement this left our belongings exposed to anyone and everyone who passed by for more than five minutes i happened to return to the room to find that situation when i went to the management at the hotel they tried to tell me that the room was unattended when clearly it was the man who left,VADER
7,1,0,152,when the best thing you can say about the hotel is that you liked the front desk staff know it not great truly the guys at the front desk were very helpful and professional we booked an eight day greek vacation after backpacking and self guiding ourselves through italy for weeks through an aegean travel agency we had two nights in athens before heading to sifnos and serifos islands and then one night in athens again before ending our trip we were picked up at the airport and transferred to hotel economy by a great taxi driver i guess we should have known by the hotel name what kind of place it would be first of all it basically in the red light district as i would call it there are therese two minutes in any direction the hotel is very dated the beds are hard and the pillows are harder the bathroom is barely big enough to change your mind they could use plastic shower curtains you flood the bathroom when you shower thank goodness for drains in the floor you have to sit on the toilet to shave your legs actually sort of handy the refrigerator does work when you leave the room it connected to the key so there no chance to have cold water when you return from your shopping or tour it very noisy outside as well as above you the continental breakfast starts ta that late if you from the us it a pretty,VADER
8,1,0,172,the staff were very nice from top to bottom the pub was nice and the breakfast was good the room was dirty and in great need of maintenance do look under the bed the lamp shades were barely hanging on the hot water faucet was loose the shower was leaking and the safe was in operable and broke either they plan on selling the property soon or plan to rent out each room until it ca be rented again the one i was in was very close to this point but on the positive side the location was great they can arrange parking for you about a block away underground and the staff is very nice bring earplugs and an open mind do pay too much and the place will be fine,VADER
9,1,0,187,be aware this hotel has two small rooms on each floor which do not have windows to the outside they have small windows that look out into a very dark small open central lobby it is our first time staying in hotel with no windows to the outside we were unlucky enough to get one of these try to sell you on their buffet breakfast euros reduced to euros if you book breakfast for the entire stay bear in mind that you can get a baguette sandwich plus a coffee for about euros from any of the little pastry shops around the hotel we did bother with their breakfast option and were glad we front desk staff is especially this one lady who works nights the only helpful person we found was maria who was very gracious and helped us with check out,VADER
10,1,0,204,came to dublin as a treat after recovering from an illness our room was shabby with the formica peeling off the furniture stains on the lampshades and grouting around the bath discoloured the air con was outdated and noisy the shower was extremely low powered the room was at the back of the hotel on the ground floor with virtually no natural light getting in therefore had to have the light on all the time how depressing large blue bins for refuge collection were lined up right outside our window the breakfast was just ok the housekeeping staff were very pleasant and courteous as were the staff in mcgettican cookhouse the food here was very good and great value,VADER
11,1,0,219,first the highlights updated hotel with comfortable rooms and a great breakfast in a great neighborhood secondly the disappointments as a gold honors member and mile flier i have stayed at a few international hotels the staff never quite got all of the amenities in my room right each day no new coffee most days bathroom amenities missed most days daily water was hit or miss on my last day of i asked for water to be replaced and was told the hotel policy was water only on the first day of arrival really this is the first major brand international hotel where i found the complimentary water rationed to one day i explained my concern to the staff and they had no answers penny wise pound foolish i will not be back,VADER
12,1,0,228,the hotel is an aging and quaint location it clearly needs some maintenance and they decided to do it right outside our rooms while we stayed there for over for days i like to sleep in peace and not be poisoned workmen woke us up on day one that day they painted in a gloss paint that had a fairly heavy odor my wife was affected by it breakfast was average and the staff attempted to be pleasant i suppose but for the money you can probably do better it was the only place in ireland we stayed in that was disappointing,VADER
13,1,0,229,very expensive for such an old fashioned place after paying as much money as we did you would expect a little more comfort quite disapointed on the plus side the staff were as accomodating as they could been,VADER
14,1,0,238,it was not a good expensive and the pool is top room for all the view from the suite were to a construction they were so kind to check us out before that was positive thing and the man in the reception were,VADER
15,1,0,240,though it a four star but there was no sign of welcome rather no doorman to open the door or porter to help u with the luggage and the outside stairs are too broad to pick ur luggage n take it till the standard room category is considered to b the lowest n they treat u as if u they r obligating u to let u rooms r very small and bathroom small in nh collection milan and straight from there came to this nhcity centre hotel which was a terrible feeling after seeing the rooms n the do have any the room was neat n clean the bedsheets ver super white n so were the towels in the honestly i m waiting to go to my next destination a little claustrophobic,VADER
16,1,0,245,the walls are very thin and the staff is very loud the rooms are very minimal the water was off the first day we got here and the electrician did let us get much sleep into the next day there is no guide to calling the front desk in the rooms and when one person smokes in their balcony every room smells it keep looking there are so many better options in this city this just seems like a careless establishment there are better prices for better locations,VADER
17,1,0,265,clean secure and central in dublin expensive for what it was a tiny room with single bed and shared bathroom worked out at on hostelworld for a midweek night should be cheaper as comparable prices around dublin can get you lots more for an extra or,VADER
18,1,0,280,well the rooms are superb and the air con is awesome for athens hot and dry summer also the staff in reception is very helpful but all these became a distant memory very soon after i entered my room i only stopped for hours to get some rest from a long ferry journey as i was catching a flight to holland and within minutes of settling into my room the lady cleaner did her best and all sorts to keep me and am sure other hotel guests awake do know where to start from but here as some of the noise some events that i heard from outside my room vacuuming next to my room and above me buckets loads of water being dropped for mopping cleaning cupboards being opened up and closed at least times the lift which is not the quietest to put it mildly must have been used for the cleaner at least times going up and down plastic bags being shuffled doors opening and closing for several times toilet seats being rigorously hit against the toilet base objects being dropped without care who sleeps in the hotel iam sure i was not the only one that was kept awake its only a small hotel for gods sake with probably around so why the f all this noise in the middle of the night will the queen of sheba arrive by any chance want a full refund and an apology for the inconvenience caused,VADER
19,1,0,289,terrible do know where to start cheaply decorated tiny room and even smaller bathroom morning man on reception is by no means but not rude like the grumpy old man in the afternoon evening we never been spoken to in such a rude abrasive manner the only decent thing was the balcony,VADER
20,1,0,294,i checked in my first day in athens before leaving on a week long drive through northern greece and booked a room for july and was assigned room a premium room it was mediocre at best but for one night did not mind it upon my return i had also booked a night august for one night also a premium room and was given room i had booked both nights before leaving on the trip room was substandard to say the least dirty and frayed curtains bad causing around sink old shower head was probably from the original construction low water pressure when i checked out and printed these out to the desk clerk he shrugged his shoulders and ignored me i surprised this hotel still has it best western affiliation if it does i bet that room was not inspected,VADER
21,1,0,296,maple hotel was an uninspiring experience ok the location is good but that is the only positive response i can give we had a double the size of a cubicle one had to sit in the bed while the other we were on the first floor facing the heavily trafficked street thank god we had earplugs,VADER
22,1,0,331,worst hotel i have stayed in there no ac holes in the door holes in bathtub dirty carpeting and a nightclub in the basement that goes till am someone should buy this hotel and make it fabulous it probably has really good bones and could be redone as a boutique hotel the staff on the other hand was very kind when we told them we had to leave due to the noise and the lack of air would recommend this to anyone,VADER
23,1,0,346,you can hear noise from next room walls are not sound proof location was the greatest to down town the rooms are not clean all the time very dusty the hotel breakfast was not good no variety,VADER
24,1,0,386,room through a maze of corridors no offer of help with luggage reception rather disinterested room has very thin walls currently listening to guy next door talkingno windows open as very stuffy from am has been noise of trollies skips being loaded and moved incredibly noisy sounds like bin lorries or similar for hoursroom must be over kitchens as smells of breakfast cooking from ok but not the cleanest literally an inch of fluff and dust on side lights above the bed are filthy furniture tatty and marked general all a bit run down and scruffy dated and dingy,VADER
25,1,0,406,the honest of the assistant service personal is questionable i lost an important mount of money of my room and they didnt anything to find it i make an pólice report in the pólice station and i waiting the results,VADER
26,1,0,420,stayed for nights room has a strange layout in a l shape and very little storage space numerous stains and dirty marks on the floor had a stunning view of the hotel roof fencing and walls quite noisy bed was small and creaky paid nearly euros for nights i paid half that in other chain hotels and had nicer room bed and service bar in the hotel is very expensive and the service is poor pub next door is brilliant disappointed with this hotel brilliant location just very poor value and standards would love to return to dublin but i would not stay here again for what it cost,VADER
27,1,0,431,my husband and i stayed here on sunday th june we arrived at pm to check in but our room was ready which was fair as we were mins early we took a seat like we were asked and tried again to check in at pm unfortunately our room was ready so we were told to leave our bags with concerige and try later we left the hotel to get some dinner and returned and tried again to check in at pm we were asked to present proof of our booking by the young man on the desk as they had no record and then we were told for the third time our room was ready we were annoyed at this stage and he offered to get the manager he returned after almost ten minutes to say room was ready no manager we received no apology no welcome to the hotel that seemed to be only for the guests who rooms were ready and no refreshments while we waited we like a lot of the guests checking in we in town for the phil collins concert and the room prices were increased to reflect this euro plus euro for parking gate for the concert opening at pm so not giving us adequate time to refresh before hand we were the only ones having trouble getting our rooms on time and the manager should have come out to apologise but he left the young man on the desk to deal with,VADER
28,1,0,451,stayed on lower level room basic room bathroom door did shut finished to poor standard inside tiling was bodge job and grout was green windows did seal people letting in all of the noise from passers by through out night did sleep friday night in dublin reception did seem interested after we told them of the issues no apology room which was worth it wish i booked something else,VADER
29,1,0,460,it is a shame as the staff work so hard to assist and make your stay enjoyable but the constant construction works and noise is off putting from early in the morning into the evening hammering drilling workmen shouting and banging of doors it is near impossible even to take a restful hour in your room during the day as it is located on a very busy main street with bars and clubs and an outdoor concert venue just down the street people party literally to the crack of dawn so expect to not have a decent of the works the rooms was too warm as the ac is not functioning all making for an exhausting stay on a good note the breakfast is plentiful and fresh,VADER
30,1,0,466,this hotel is in the temple bar district i was disappointed with the price of the hotel and the size of the rooms when we first got there i was given an room that was already occupied than was given a room that was so small you could hardly move in it is in the temple bar district it was very noisy at night until am due to the night club in the hotel and clubs on the street the breakfast in the morning was wonderful i would recommend this hotel for the young at heart,VADER
31,1,0,471,rooms are tiny no privacy glass doors on en suite rooms very noisy can hear everything from room next door waited mins to be served at bar gave up went down the street to a supermarket bought our own drinks great restaurant next to hotel,VADER
32,1,0,477,i was dissapointed with the service we was stay four wasnt redy for wasnt enough towel and bath producs even service was verry am never dissapointed with any hotel ike this before,VADER
33,1,0,486,if you like a small room untidy floor and industrial extractor fans all day then this is for you i stayed in this hotel before and took into account the location and the fact that the building is old the beds were comfortable however this time there was no escaping the fact that the room had not been cleaned and the noise level was beyond ridiculous previously i had been at the front of the property so nightlife influences things considerably but the room this time was so small there was no escaping the noise it sounded like the window was fully open and it was the only quiet place was the bathroom and had there been a bath i most likely would have slept there having had a terrible sleep even with ear plugs i stepped out of the bed to go for a refreshing shower and found that a piece of pepper that had been around the bed not mine became stuck to my foot the level of gross was not pleasant to say the bar is lovely the location great if you completely deaf and the rooms a roll of the dice for the area there are better choices that give a good nights rest,VADER
34,1,0,495,beautiful hotel lovely location nice breakfast great buffet the hotel was not cleaning service in the room is not we had days no shower gel the other day we had no towels for two you can walk in and out nobody was talking,VADER
35,1,0,543,let start with the positives friendly helpful staff great welcome cloud pool good food lovely place to chill out in the evening and barman chris was fabulous pool good toolocation mins from alimos marina so handy if you hiring a yachtthe tv worksso the negatives we booked a family room and got two rooms not interconnecting ok for us as we have teens but not great for younger rooms were functional at best decor dated patched up in places and they reeked of cigarette smoke shower woefully inadequate fell out of its holder several times bulbs missing it on a very noisy main road despite double glazed doors and seemingly some rooms have thick blackout curtains and others not breakfast basic meat cheese bread yoghurt etc all ok but overcooked cooked breakfast fried eggs like booked through ba and the reviews were ok but seriously this is a very basic hotel we were here less than hours and that was hours too many,VADER
36,1,0,574,hotel is older but clean cozy yet comfortable we were looking for a place to lay out heads this fit the bill price was good you get what you pay for like the big bang theory the elevator does not work but we knew that ahead of time this hotel is in the heart of the temple district with shops bars and numerous restaurants just outside the door we found all forms of transit within simple walking distance staff is friendly no early checkin,VADER
37,0,1,578,went to a concert here last saturday to see coldplay and the place was run exceptionally well the only downside was the cost of beer or wine as they have you inside they can charge what they will but it was very well run and with people leaving was no problem,VADER
38,1,0,591,we picked this hotel over another athens hotel because it had dedicated parking and a pool we arrive and my husband goes to park only to be informed a car is too big and we are not allowed to park there i was not happy however the front doorman came to the rescue and found us parking garage he was so nice and had great customer service skills and was the only good thing about our got up to our rooms needed to book because of our big family to find twins bed pushed together in each room not the best but it worked the furniture is dated the tvs are ancient smells like smoke and there is no shower door or curtain it is just a half glass wall so water goes everywhere to top it off they charge euro a day for internet access in the room and that is only for devices probably the worst thing about this hotel is the pool area they have a beautiful rooftop pool with a bar however it is a very small pool area it is lined with chairs and people sunbathing on the ground so you can hardly walk around the pool we arrived at the first day at knowing it closes at with kids in tow the lifeguard proceeded to get an attitude and tell me that there are no more towels and we only have mins to swim so we should come back tomorrow well my kids were,VADER
39,1,0,596,loved the vat pub traditional irish music after from somewhere pounding driving music from nearby venue kept us awake all night long front desk was interested the next day when i reported it it more like a hostel taxi driver had had an ominous smirk when he dropped us off now i know why,VADER
40,1,0,608,whilst rooms were breakfast excellent our holiday was ruined because on out of nights our sleep was constantly disturbed by revelers on our floor doors banging people running in the corridor and loud shouting when reception was approached both during the night first thing in the morning they showed little concern and even appeared to be amused no apology was given ironically a card is left in each room with a quote from the dalai lama sleep is the best meditation what a joke,VADER
41,0,1,662,a little far from airport and shuttle requires fee free for hh members dinner was good also had entertainment in bar which was also good bed was a queen but was two less than twins couples together not great but we were exhausted and slept well,VADER
42,1,0,692,i can under stand when hotels get busy that you need to wait but when people who are booked in advance at least groups by my count are told to wait some over an hour while off the street are checked in well that is clearly all their rooms became available at once so clearly there is no coordination between and front desk they could have avoided the problem by having housekeeping release the rooms for check in one by their systems are more important than the a pleasant stay,VADER
43,1,0,704,stayed here at the start of july when we arrived after we payed and asked for a receipt but we were told we would recieve the receipt as we checked out at the end of the week we were then told our room was ready and we could check in until when it states on the website that we should be able to check in from onwards when we checked out they tried to charge us again and we had to show that they had taken the money on our banking app otherwise the stay was pleasant and the hotel is in a good location,VADER
44,1,0,706,let s start with the positive parts the location is great the pool area is wonderful the view from the rooftop is breathtaking and the reception is professional and service minded beside this it s hard to say much more positive our rooms were smelly a bit runned down and not properly cleaned the sides of the bathtub were dirty and there were hair in the corners of the bathroom the elevators are small and slow the staff at the breakfast were rude and the client computers were old and outdated could be that the hotel has been renovated in but nothing seems to have been improved changed since then,VADER
