,predlabel,trueLabel,indexLocat,review,classification
30,1,0,546,i was taking my daughter and two granddaughters on their first trip to europe cruise on mediterranean to italy decided to spend days in lovely barcelona first chose and reserved two rooms beds bathrooms and sea view a year in advance all confirmed and then reconfirmed upon arrival one room ready exactly what i wanted adjoining room was then given away while we waited for luggage offered apologies and then a suite suite had no sea view only beds only full bathroom i was supposed to sleep on a sofa bed and rollaway we let my granddaughters use the suite i went back to original room offered free cocktails with dinner and that was it by the way is near hospital so sirens all night service at meals was excellent but would never use hotel again,VADER
31,1,0,549,we stayed for a long weekend break our room was on the rooftop which was lovely bar the unclean jacuzzi which we could really use our main issue was that someone had been in our room on more than one occasion we had been out during the day our room had been cleaned with fresh bedding and toiletries lovely we then came back after being out for our tea and someone had been in our room and looked through our suitcases and bags this made us feel very unsafe and paranoid the second to last day when we came home after a day out touring the city the had taken one of our keys which we kept in the electricity port to keep the room cool with the air con our bags had been moved again when i asked reception why the key had gone she replied it happens sometimes i sure this should not happen at all i never been in a hotel where the cleaner or anyone else takes the key and you had your bags rummaged through we did eat in the hotel or use the bar the room was alright but we probably would stay again,VADER
32,1,0,564,staff very pleasant we had a triple room clean basic we where at a music festival with a group of girls some stayed on the first floor some on the second the girls on the first floor had no sleep as the music was thumping into their room throughout the night from the beer garden nightclub bar you are supplied with earplugs in the drawer they got some discount the next day after complaining we paid each for breakfast but it was not worth it fine for but i would recommend for a family,VADER
33,0,1,596,if i am back to barcelona i will visit this hotel again definitely i recommend this hotel if you are planning to visit barcelona but the noise of subway train was little bit annoying when i tried to sleep because i can feel and hear when the subway train comes near,VADER
34,1,0,597,the honest of the assistant service personal is questionable i lost an important mount of money of my room and they didnt anything to find it i make an pólice report in the pólice station and i waiting the results,VADER
35,1,0,624,the hotel has free wifi and is located in one of barcelonas most busy streets a short walk gets you to great restaurants as stores and that about it the room was really small having a suitcase got to be a problem we had to place some of our luggage in the bathroom the bathroom contained some hair from other guests and god knows what else the elevator did work the tv had three spanish channels and the breakfast cost extra perfect since the room did offer a simple do not disturb sign it was easy for the housekeeper to wake you up at to tidy your room next time no thanks hotellet er plassert sentralt i barcelonas mest travle gate gåavstand til butikker og gode restauranter gratis wifi der stopper det positive kun spanske kanaler på små rom uten plass til koffert eller sekk sekken måtte for øvrig plasseres på badet badet inkluderte hår fra tidligere gjester heisen var i ustand og alt dette til tross for en vanvittig høy pris for rommet i tillegg manglet enkle ting som et ikke forstyrr til døra pga dette kunne man raskt bli vekket kl noen skulle vaske rommet neste gang nei takk,VADER
36,1,0,630,my husband and i stayed here on sunday th june we arrived at pm to check in but our room was ready which was fair as we were mins early we took a seat like we were asked and tried again to check in at pm unfortunately our room was ready so we were told to leave our bags with concerige and try later we left the hotel to get some dinner and returned and tried again to check in at pm we were asked to present proof of our booking by the young man on the desk as they had no record and then we were told for the third time our room was ready we were annoyed at this stage and he offered to get the manager he returned after almost ten minutes to say room was ready no manager we received no apology no welcome to the hotel that seemed to be only for the guests who rooms were ready and no refreshments while we waited we like a lot of the guests checking in we in town for the phil collins concert and the room prices were increased to reflect this euro plus euro for parking gate for the concert opening at pm so not giving us adequate time to refresh before hand we were the only ones having trouble getting our rooms on time and the manager should have come out to apologise but he left the young man on the desk to deal with,VADER
37,0,1,640,a very good travelodge on the outer edges of the city but a good walk in and the busess stop right outside and are every few minutes so no problem with getting in and out no cafe onsite but a cafe a few doors down that does a really good breakfast and was reasonably priced,VADER
38,0,1,699,i stopped by here before my business meeting to find that the gresham has now been rebranded as hotel riu plaza the gresham it still as impressive as it was before and the selection of teas and coffees were second to none it a wonderful place any time of the day,VADER
39,1,0,702,easy access to all the sights and temple bar shopping cathedrals castle but clearly not worth the price felt like a very low rate motel when there are plenty of other options in the area that are much nicer,VADER
40,0,1,709,love staying here when i visit dublin great staff comfortable hotel rooms and great location i did notice that toiletries were very sparce this time shampoo and soap but call to reception if you need shower caps surely cut backs should result in lower prices not so i afraid breakfast has improved i think fresh bread and hot food even for latecomers what really disappointed me this time was the bar food we were in a hurry and just asked for sandwich and some chicken wings the sandwich was smothered with mustard and arrived in a box with no garnish whatsoever the chicken wings were inedible i afraid no taste at all so pale i wondered if they were cooked right through the batter they used had no seasoning and tasted of taste on chicken either blue cheese dip was not pleasant very expensive too not a very good impression for our tourists really ought to step up and offer a bit more great hotel otherwise,VADER
41,0,1,767,the hotel met our needs it located close to the dam square the red light district and the central breakfast was very reception staff was took a room in the fifth floor it was basic room and very small but it did bother us because we spent all our time outside but if you plan to stay more time in the hotel room you should ask for bigger room,VADER
42,1,0,799,motel one is far from the city centre and top attractions the central station is very far top attractions and canals will take you around minutes by the public transportation staff were rude no bath available just shower no iron or british electricity adaptors were given rooms were too small keep your passport and money in safe place as no deposit safe was there it is simply a motel not hotel i misunderstood the motel facilities due to reviewers comments and i made a wrong decision if i will be going to amsterdam again i will go for another option,VADER
43,1,0,814,the whole experience was disappointing we were made to wait for minutes before our room was ready and this is after the check in time of there was a line of people waiting and we had to queue three times before our room was finally ready we entered a warm stuffy room where the air conditioning has not been switched on it is definitely not what i had expected based on the review i will definitely not be coming back be ready to be disappointed,VADER
44,1,0,823,noise from other room is so big that i could sleep well every some water that where it came from are all around my shoes so my new shoes from barcelona became wet two things above was bad but other things about the hotel was good,VADER
45,1,0,827,i can under stand when hotels get busy that you need to wait but when people who are booked in advance at least groups by my count are told to wait some over an hour while off the street are checked in well that is clearly all their rooms became available at once so clearly there is no coordination between and front desk they could have avoided the problem by having housekeeping release the rooms for check in one by their systems are more important than the a pleasant stay,VADER
46,0,1,836,i booked this hotel mostly based on price and location we were in dublin for the concert and visiting the city for the first time so i wanted something affordable yet centrally located so we could get where we needed to go without spending too much on taxis the hotel was great there are four of us two tall teen boys in tow and i wanted to be sure we were stacked on top of each other i read reviews of the family room in this hotel and hoped it would live up to our expectations it did and then some upon arrival we were told it would be another hour before a room was ready fine since it was well before scheduled check in i pause the review here and note to first time overseas travelers from the us that flights arrive in the morning but the hotels are always able to accommodate you until their scheduled checkin no matter how high priority you have in a rewards program getting angry at the hotel staff for this does no good and just adds to the reputation americans have of being arrogant travelers we saw this again upon arrival at this hotel americans angry that no room is available at am checkin is clearly noted as pm if your flight arrives at am and you want to be in your hotel at am you need to book it for the night prior if you can not do that then do,VADER
47,0,1,849,hubby and l stayed here nights location is superb staff were friendly and quite helpful dealing with our missed baggage breakfast is on the rooftop with views of the acropolis decent selection of food choices cereals cold cuts fruit yoghurt eggs bacon and potatoes and sweet pastry good enough for us had the rooms been modernised we would have rated it higher but l know other cruise travellers stayed at much higher rated hotels and were not in such a great location and felt less inclined to wander out at night we hsd no problem with that being so central a short walk to hop bus shopping cafes and restaurants the plaka district etc,VADER
48,1,0,861,for being a hilton hotel you expect high and good service when the prices are that high forgot our orderlazy in the barservice remote did worktook the freedom of giving us the most expensive alcohol in the drinks without askinggave us the wrong billthe staff were friendly but should maybe have a lesion in hotel service not worth the visit,VADER
49,0,1,868,it is close to the see and offices in that area however far from city center i could not set properly the room air condition it was too coold or warm i didn ot find description about room thermostat settings the area is quiet but i do not recommend to get room on the street side on to floors too much traffic noise,VADER
50,1,0,874,i bought this trip through travel republic as a surprise for my husbands birthday i emailed ahead and asked for a nice room with a view as it was a surprise i had booked transfers arrived and there was no one waiting for us we waited for half an hour but nothing we walked minutes through the terminals and we came across the transfer office they did not apologise just made a phone call and said minutes minutes later still nothing so i went back to the desk and they made another call and said minutes we were completely fed up by this arrived at the hotel and the lady on reception told us to check in at and took our bags and gave some information about catching buses etc she was the only helpful person i came across we collected our luggage and went to the room yes we had a sea view and the window opened wide which was nice and that is the only good thing i can say about this hotel the room is in dire need of updating walls are badly marked and when u pull back the curtain there was mould the bed was hard and the only plug socket you could use was if you unplugged the lamp or fridge trying to get ready was a big issue as a woman the hairdryer was in the bathroom but getting ready in there was impossible no air con in bathroom gets too hot to,VADER
51,0,1,875,the hotel was reasonable the rooms on higher floors have a nice view on the sea the rooms were shabby but properly cleaned the breakfast was not wow a small hotel located at walking distance from glyfada center,VADER
52,1,0,902,the temperature outside is and there is a tiny window in a room for four if one person takes a shower the room is too warm if two take a shower it a sauna for the rest of the night i have encounter the little window phenomenon throughout ireland but his huge monster of a hotel is hot throughout sleeping happens after he room has cooled down around stick to airbnb most homes and flats have actual portals to the outside air,VADER
53,1,0,947,this would have been good for a hotel but not for hilton top of the line we stayed for three nights and the experience was a let down two nights there was no turn down or attention to the room the concierge service ranged from outstanding to i ca be bothered but the front desk was outstanding two out of three breakfasts were terrible the buffet items were outstanding but after seating and the initial coffee the wait staff had to be called they never would come back to check to see if we needed anything that was not on the buffet i felt they may have been shunning staff at lemuel bar and lounge generally did a good job,VADER
54,0,1,977,the hotel was nice and modern the restaurant was also very good the public transportation is right outside the hotel which is convenient but i did realize it was really downtown we walked downtown and it was a minute walk the round trip public transportation price is about per person or all day the staff gave us bad information about the taxi to the airport though said they take credit cards they did not and said it would be to depending on traffic but it cost we had to run inside and pay the fee at the atm to pay the taxi driver this was a taxi that they booked for us,VADER
55,0,1,1004,this hotel is warming there is a bus stop outside takes you to the city rooms are very stylish and comfy beds very are so attentive and is round defo star,VADER
56,1,0,1016,stay of nights there as hhonors diamond you should be treated fairly unfortunately not at all no welcome for breakfast the hotel do a segregation of hhonors member on the underground with a limited food and untasteful moreover the staff is far to be professional and spend more time to chat and joke than take care of customer this hotel is not at all as hilton level and should be removed from hilton group,VADER
57,1,0,1029,good location with easy access to metro all staff were very friendly and helpful from start to there was only flat pillow per bed we stayed four nights and old towels and rubbish was taken out or toilet roll renewed for the whole time we stayed i had to go downstairs to reception twice to ask the receptionist to get us towels and toilet very basic things in my seemed annoyed when i went down the first day that it had been done by accommodation staff yet it happened again the following day again nice clean basic rooms great power in the work nearby acted as alarm clocks at most mornings and people coming in an out of other rooms on the corridor could be heard,VADER
58,0,1,1030,strategic place to stay the hotel is in amsterdam city near to station shopping center clubbing etc just walk a step you find everything you need the services is excellence but unfortunately there is no lobby are for parking a car,VADER
59,1,0,1046,very tired looking hotel which desperately needs some love first room offered was in the basement and was really noisy moved to the top and was still really noisey due to the seedy all night clubs over the road room walls were heavily stained and the room had an unpleasant musty odour like most hotels in dublin it is overpriced but if you going to pay over the odds you may as well pay a tenner more and go somewhere nice,VADER
60,1,0,1105,very expensive for such an old fashioned place after paying as much money as we did you would expect a little more comfort quite disapointed on the plus side the staff were as accomodating as they could been,VADER
61,1,0,1111,the beds were decent the bathroom was worn with rust and discolored tile grout but it was all functional and very important for us well working ac the wifi however was painfully slow a limit of only devices was certainly an issue for us as we had to take turns getting on it,VADER
62,1,0,1125,it a below average dingy hotel with better alternatives for the same rates at nearby locations it very outdated hotel with outdated furniture that have stood the test time but their time has come reception staff were just fine but nothing to write home about location was good but i had stayed in a nearby hotel slightly better location for the same price but that was very modern and fully refurbished i think it was called definitely would stay here nor recommend i would highly advise a full refurbishment to the furniture and dirty carpets,VADER
63,1,0,1142,this was a short break for myself and daughter booked through secret escapes the hotel was very central just a five minute walk from last rambla the receptionist was very friendly and informative our room was small but clean we followed instructions for the safety deposit box but could get it to work we see told it would be done the next day not ideal to carry your valuables around the city complimentary wine and glasses after use were left in the room for our entire stay despite housekeeping every day the lights in the bedroom stopped working after the first day we were advised to play around with them until they worked did then the bathroom ceiling leaked water from the upstairs room breakfast was varied and acceptable but food remnants remained under the tables after tables were wiped on our checkout surprisingly we were asked if we enjoyed our stay,VADER
64,1,0,1146,not normally something i do as i believe that people have off days but i just had to comment on my recent stay at w hotels as i found the following to be causes of checked into the hotel from another hotel in the city as we changed our flights and wanted something a bit more in keeping with what we re used to and decided to book at the hotel at and went directly to the floor for check in we were advised that the room would be ready shortly and that they could take our bags and would be returned to us upon to the room and that they would contact us directly by text to advise the room s availability it came to and we had still not been contacts so we went through to reception where they d my payment card even though i had already provided full for recommendations of lunch and was given a suggestion of the focaccia dip and the spicy tomatoes the tomatoes were lovely but the focaccia was burnt and then asked about the spa facilities in the hotel and were advised that they were indeed closed for the day due to unforeseen being a guest at hotel de lerope in amsterdam i decided to visit w as it was a more modern hotel and thought that it would have a younger and more feel to it but this did not live up to the calling reception times over the period,VADER
65,1,0,1154,the only pleasant part of our stay at hotel adagio was the location the room temperature controlled by the front desk for each floor was inconsistent and set in either extreme the wifi was spotty and never reliable which caused an inconvenience for travelers relying on that for access to maps etc the lobby and part of the hotel always had a very unpleasant odor and because of this we never cashed in on our complimentary tapas as to avoid sitting down there for a long period of time to top it all off we got home from vacation and realized we have beg bug bites all over again the location was great but i would recommend looking into other choices close by,VADER
66,1,0,1157,i travel a lot and stay in a lot of hotels that carry stars unfortunately in my opinion herbert park is at most when i moved into my there was silicone falling off in pieces above the mirror in the bathroom the wooden panel that covered the bottom of the tub was splitting and paint was chipping the pillows smelled in one of the hallways the wall phone was hanging by the wires etc i was moved immediately to a different which was little better but still faced the same issues i do have to give some credit to the staff everyone was friendly and the cleaning staff was superb all rooms need a face lift or a star needs to go,VADER
67,1,0,1171,one to avoid and i do say that lightly stayed here as it was adjacent to the iveagh gardens and a dropkick murphy gig we were attending with good friends on the face of it a half decent hotel but let down very badly once you scratch the surface no aircon the rooms are melting at best but if you manage to negotiate the safety clasp on the window you can get some air into the room but then the million seagulls keep you awake from the crack of dawn which in july is obviously early just as the brain is beginning to accept the squeaking seagulls the hotel offers a new alarm call tap tap tap on the door so i open the door to a sheepish eastern european girl who is already walking away down the corridor sorry i just checking rooms forgive me but that cheap cheap cheap check out is actually noon so why are you waking us up never ever again disgraceful city centre hotel,VADER
68,1,0,1172,i booked and paid in advance for a superior room which was rather more expensive than the standard room however on check in we were given a standard room these rooms do not have windows and i was aware of this which is why i booked the more expensive room on alerting the reception staff we were given another room next the lift on another floor the hotel is not well sound proofed and we heard people coming and going in and out of the lift all night for nights the hotel had allowed a large group of british men to book a large number of rooms at the hotel they took over the pool and bar area and had no respect for other guests and some were staying on our floor and very loud this was the last stop for us after an week trip and we were looking forward to sitting by the pool which we were not comfortable in doing we were required to pay a euro bond on our debit card which we were told would be refunded on check out at checkout we were told this refund would take days we stayed in hotels throughout europe and this was the only hotel that took a security bond reception staff were condensing and not very approachable on the positive the breakfast was very good and the location very central,VADER
69,0,1,1202,the hotel is very well situated the room was nice and simple with a big smart tv and the staff was great however i was disappointed with my poor late night dinner ordered some pasta with tomato sauce but they tasted really bad,VADER
70,1,0,1225,i expected much more from this hotel having seen the photos and in light of the price i paid the room is ok size but beds very uncomfortable the hotel seem to have no proper walls between the rooms and awful sound insulation you can hear the person next door sneezing the blinds made such noise that each evening and morning it was disturbing as guests would put them up or down the roof terrace is nice but the pool is expect to have a proper swim although it does serve the purpose to cool down in a hot weather all in all disappointing experience having said this the staff is really nice welcoming and friendly,VADER
71,1,0,1247,whilst rooms were breakfast excellent our holiday was ruined because on out of nights our sleep was constantly disturbed by revelers on our floor doors banging people running in the corridor and loud shouting when reception was approached both during the night first thing in the morning they showed little concern and even appeared to be amused no apology was given ironically a card is left in each room with a quote from the dalai lama sleep is the best meditation what a joke,VADER
72,1,0,1259,when i got to the hotel i was amazed by the beautiful modern and clean smell of the lobby that image was destroyed when i got into the room the carpet was filthy full of stains and the humidity smell was awful the ac did work which made the humidity worst i was changed twice to different rooms but the problems were the same at midnight one of the front desk guys came and advised me they did have any ac i finally quit and tried to enjoy the stay peter from the front desk was very helpful and nice to even gave us good recommendations to enjoy the city which we loved despite the hotel rooms breakfast is varied and good restaurant food is delicious expensive though,VADER
